publisher,source,source_url,category,rank,headline,link,collected_at_iso
Mint,Mint • Sports,https://www.livemint.com/sports,sports,10,Dhruv Jurel's acrobatic stumping in KKR vs RR grabs worldwide attention,https://www.livemint.com/sports/cricket-news/dhruv-jurels-acrobatic-stumping-in-kkr-vs-rr-grabs-worldwide-attention-leaves-sachin-tendulkar-kevin-pietersen-in-awe-11776618821105.html,2026-04-21T01:28:48+00:00
Mint,Mint • Sports,https://www.livemint.com/sports,sports,11,"Archer strikes first ball in IPL 2026 once again, equals Shami's record",https://www.livemint.com/sports/cricket-news/jofra-archer-strikes-first-ball-in-ipl-2026-once-again-joins-lsgs-mohammed-shami-in-elite-list-during-kkr-vs-rr-11776601321528.html,2026-04-21T01:28:48+00:00
Mint,Mint • Sports,https://www.livemint.com/sports,sports,12,IPL 2026: LSG receive big boost as skipper Rishabh Pant to play against PBKS,https://www.livemint.com/sports/cricket-news/ipl-2026-lucknow-super-giants-receive-big-boost-as-skipper-rishabh-pant-cleared-to-play-against-punjab-kings-11776597312193.html,2026-04-21T01:28:48+00:00
Mint,Mint • Sports,https://www.livemint.com/sports,sports,13,Shreyas Iyer emerges as strong favourite to become India's next T20I captain,https://www.livemint.com/sports/cricket-news/punjab-kings-skipper-shreyas-iyer-emerges-as-strong-favourite-to-become-indias-next-t20i-captain-says-report-11776591682999.html,2026-04-21T01:28:48+00:00
Mint,Mint • Sports,https://www.livemint.com/sports,sports,14,"KKR vs RR Live Score, IPL 2026: Kolkata Knight Riders record maiden win",https://www.livemint.com/sports/cricket-news/kkr-vs-rr-ipl-2026-live-score-updates-kolkata-knight-riders-vs-rajasthan-royals-match-today-full-scorecard-april-19-11776588623572.html,2026-04-21T01:28:48+00:00
Mint,Mint • Sports,https://www.livemint.com/sports,sports,15,IPL 2026: Big boost for KKR? Matheesha Pathirana joins team,https://www.livemint.com/sports/cricket-news/ipl-2026-big-boost-for-kolkata-knight-riders-matheesha-pathirana-joins-struggling-team-for-remainder-of-season-11776586572870.html,2026-04-21T01:28:48+00:00
Mint,Mint • Sports,https://www.livemint.com/sports,sports,16,BCCI renews chief selector Ajit Agarkar's contract by one year,https://www.livemint.com/sports/cricket-news/bcci-renews-chief-selector-ajit-agarkars-contract-by-one-year-ex-india-pacer-set-to-continue-till-june-2027-11776582428362.html,2026-04-21T01:28:48+00:00
Mint,Mint • Sports,https://www.livemint.com/sports,sports,17,IPL 2026: CSK's Ayush Mhatre to be sidelined after suffering hamstring tear,https://www.livemint.com/sports/cricket-news/ipl-2026-chennai-super-kings-youngster-ayush-mhatre-to-be-sidelined-after-suffering-hamstring-tear-11776578298016.html,2026-04-21T01:28:48+00:00
Mint,Mint • Sports,https://www.livemint.com/sports,sports,18,IPL 2026: Ashwin slams CSK team management for letting Mhatre bat despite injury,https://www.livemint.com/sports/cricket-news/ipl-2026-r-ashwin-slams-csk-team-management-for-letting-ayush-mhatre-bat-against-srh-despite-injury-very-surprising-11776574859922.html,2026-04-21T01:28:48+00:00
Mint,Mint • Sports,https://www.livemint.com/sports,sports,19,"PBKS vs LSG, Match 29 Preview: Punjab still undefeated, Lucknow need points",https://www.livemint.com/sports/cricket-news/pbks-vs-lsg-match-29-preview-punjab-still-undefeated-lucknow-need-points-check-head-to-head-pitch-report-more-11776570271981.html,2026-04-21T01:28:48+00:00
Mint,Mint • Sports,https://www.livemint.com/sports,sports,20,"KKR vs RR, Match 28 Preview: Desperate Kolkata face the abyss at Eden Gardens",https://www.livemint.com/sports/cricket-news/kkr-vs-rr-match-28-preview-desperate-kolkata-face-the-abyss-at-eden-gardens-check-head-to-head-pitch-report-more-11776563328416.html,2026-04-21T01:28:48+00:00
Mint,Mint • Sports,https://www.livemint.com/sports,sports,21,Who is Juha Miettinen? Driver dies in Nürburgring race featuring Max Verstappen,https://www.livemint.com/sports/news/who-is-juha-miettinen-driver-dies-in-nurburgring-race-featuring-max-verstappen-11776555342013.html,2026-04-21T01:28:48+00:00
Mint,Mint • Sports,https://www.livemint.com/sports,sports,22,Big boost for KKR in IPL 2026; When is Matheesha Pathirana joining?,https://www.livemint.com/sports/cricket-news/matheesha-pathirana-boost-for-kkr-before-rr-clash-will-knight-riders-rush-sri-lankan-amidst-winless-ipl-2026-campaign-11776533148243.html,2026-04-21T01:28:48+00:00
Mint,Mint • Sports,https://www.livemint.com/sports,sports,23,"SRH vs CSK highlights, IPL 2026: Sunrisers Hyderabad win by 10 runs on home soil",https://www.livemint.com/sports/cricket-news/srh-vs-csk-ipl-2026-live-score-updates-sunrisers-hyderabad-vs-chennai-super-kings-match-today-full-scorecard-playing-xi-11776512423984.html,2026-04-21T01:28:48+00:00
Mint,Mint • Sports,https://www.livemint.com/sports,sports,24,IPL 2026 RCB Vs DC Highlights: Delhi Capitals win by 6 wickets,https://www.livemint.com/sports/cricket-news/rcb-vs-dc-ipl-2026-live-score-royal-challengers-bengaluru-vs-delhi-capitals-match-today-full-scorecard-chinnaswamy-11776500031478.html,2026-04-21T01:28:48+00:00
Mint,Mint • Sports,https://www.livemint.com/sports,sports,25,"SRH vs CSK, Match 27 Preview: The South battle gets intense in fight for Top 4",https://www.livemint.com/sports/cricket-news/srh-vs-csk-match-27-preview-the-south-battle-gets-intense-as-hyderabad-and-chennai-fight-for-top-4-11776496951127.html,2026-04-21T01:28:48+00:00
Mint,Mint • Sports,https://www.livemint.com/sports,sports,26,Former England cricketer Moeen Ali reveals why he chose to play in PSL over IPL,https://www.livemint.com/sports/cricket-news/former-england-cricketer-moeen-ali-reveals-why-he-chose-to-play-in-psl-over-ipl-i-ve-always-wanted-to-11776496324309.html,2026-04-21T01:28:48+00:00
Mint,Mint • Sports,https://www.livemint.com/sports,sports,27,Sarfaraz Ahmed named Pakistan head coach for Test series against Bangladesh,https://www.livemint.com/sports/cricket-news/former-captain-sarfaraz-ahmed-named-pakistan-head-coach-for-two-match-test-series-against-bangladesh-11776491533502.html,2026-04-21T01:28:48+00:00
Mint,Mint • Sports,https://www.livemint.com/sports,sports,28,"RCB vs DC, Match 26 Preview: Delhi look to stop Bengaluru’s winning chariot",https://www.livemint.com/sports/cricket-news/rcb-vs-dc-match-26-preview-delhi-look-to-stop-bengaluru-s-winning-chariot-check-head-to-head-pitch-report-more-11776491093711.html,2026-04-21T01:28:48+00:00
Mint,Mint • Sports,https://www.livemint.com/sports,sports,29,IPL 2026: SRH name Gerald Coetzee as replacement for injured David Payne,https://www.livemint.com/sports/cricket-news/ipl-2026-sunrisers-hyderabad-name-south-africas-gerald-coetzee-as-replacement-for-injured-david-payne-11776486964826.html,2026-04-21T01:28:48+00:00
Mint,Mint • Sports,https://www.livemint.com/sports,sports,30,R Ashwin urges BCCI selectors to recall Shreyas Iyer to India T20I team,https://www.livemint.com/sports/cricket-news/r-ashwin-urges-bcci-selectors-to-recall-shreyas-iyer-to-india-t20i-team-amid-impressive-ipl-2026-form-he-has-evolved-11776427816425.html,2026-04-21T01:28:48+00:00
Mint,Mint • Sports,https://www.livemint.com/sports,sports,31,"GT vs KKR highlights, IPL 2026: Knight Riders remain winless as Gujarat win",https://www.livemint.com/sports/cricket-news/gt-vs-kkr-ipl-2026-live-score-updates-gujarat-titans-vs-kolkata-knight-riders-match-today-full-scorecard-ahmedabad-11776429878715.html,2026-04-21T01:28:48+00:00
Mint,Mint • Sports,https://www.livemint.com/sports,sports,32,Who is Connor Esterhuizen? Gujarat Titans' replacement player in IPL 2026,https://www.livemint.com/sports/cricket-news/who-is-connor-esterhuizen-gujarat-titans-replacement-player-after-englishman-tom-banton-ruled-out-of-ipl-2026-11776426941267.html,2026-04-21T01:28:48+00:00
Mint,Mint • Sports,https://www.livemint.com/sports,sports,33,"IPL 2026: RR manager handed fine, warned over mobile phone use during match",https://www.livemint.com/sports/cricket-news/ipl-2026-rajasthan-royals-manager-romi-bhinder-fined-warned-over-mobile-phone-use-during-rcb-match-says-report-11776424283427.html,2026-04-21T01:28:48+00:00
Mint,Mint • Sports,https://www.livemint.com/sports,sports,34,IPL 2026: Ex-India cricketer urges KKR to drop Rahane if fortunes don't change,https://www.livemint.com/sports/cricket-news/ipl-2026-ex-india-cricketer-kris-srikkanth-urges-kkr-to-drop-skipper-ajinkya-rahane-if-fortunes-dont-change-11776419871789.html,2026-04-21T01:28:48+00:00
Mint,Mint • Sports,https://www.livemint.com/sports,sports,35,IPL 2026: Ex-India cricketer urges Hardik Pandya to give up MI captaincy,https://www.livemint.com/sports/cricket-news/ipl-2026-ex-india-cricketer-urges-hardik-pandya-to-give-up-mi-captaincy-amid-teams-poor-form-very-important-to-be-11776413482310.html,2026-04-21T01:28:48+00:00
Mint,Mint • Sports,https://www.livemint.com/sports,sports,36,"GT vs KKR, Match 25 Preview: Kolkata in do-or-die clash, Titans ride on momentum",https://www.livemint.com/sports/cricket-news/gt-vs-kkr-match-25-preview-kolkata-in-do-or-die-clash-titans-ride-on-momentum-check-head-to-head-pitch-report-more-11776413614808.html,2026-04-21T01:28:48+00:00
Mint,Mint • Sports,https://www.livemint.com/sports,sports,37,IPL 2026: R Ashwin says MI still feeling ‘fatigue’ from India’s T20 WC title win,https://www.livemint.com/sports/cricket-news/ipl-2026-r-ashwin-says-mumbai-indians-still-feeling-indias-t20-wc-title-win-fatigue-previously-they-used-to-11776409144787.html,2026-04-21T01:28:48+00:00
Mint,Mint • Sports,https://www.livemint.com/sports,sports,38,Canada's T20 WC 2026 campaign under scanner as ICC's ACU begins probe,https://www.livemint.com/sports/cricket-news/canadas-t20-world-cup-2026-campaign-hit-by-match-fixing-allegations-as-icc-anti-corruption-unit-begins-probe-report-11776404663960.html,2026-04-21T01:28:48+00:00
Mint,Mint • Sports,https://www.livemint.com/sports,sports,39,IPL 2026: MI coach Mahela Jayawardene backs Jasprit Bumrah amid wicketless run,https://www.livemint.com/sports/cricket-news/ipl-2026-mi-coach-mahela-jayawardene-backs-jasprit-bumrah-amid-wicketless-run-once-he-starts-11776399879797.html,2026-04-21T01:28:48+00:00
Mint,Mint • Sports,https://www.livemint.com/sports,sports,40,Mark to Market,https://www.livemint.com/market/mark-to-market,2026-04-21T01:28:48+00:00
Mint,Mint • Sports,https://www.livemint.com/sports,sports,41,Breakout stocks to buy or sell: Sumeet Bagadia recommends five shares to buy today - 21 April 2026,https://www.livemint.com/market/stock-market-news/breakout-stocks-to-buy-or-sell-sumeet-bagadia-recommends-five-shares-to-buy-today-21-april-2026-11776731784385.html,2026-04-21T01:28:48+00:00
Mint,Mint • Sports,https://www.livemint.com/sports,sports,42,Stocks to trade: Raja Venkatraman recommends three stocks for 21 April,https://www.livemint.com/market/stock-market-news/stocks-to-trade-raja-venkatraman-expert-stock-picks-21-april-11776700172349.html,2026-04-21T01:28:48+00:00
Mint,Mint • Sports,https://www.livemint.com/sports,sports,43,Stock recommendations for 21 April from MarketSmith India,https://www.livemint.com/market/stock-market-news/stock-recommendations-for-21-april-from-marketsmith-india-11776691130867.html,2026-04-21T01:28:48+00:00
Mint,Mint • Sports,https://www.livemint.com/sports,sports,44,Big conglomerates’ grip on market cap steadily loosens as new-age firms rise,https://www.livemint.com/market/big-conglomerates-grip-on-market-cap-steadily-loosens-as-new-age-firms-rise-11776683798397.html,2026-04-21T01:28:48+00:00
Mint,Mint • Sports,https://www.livemint.com/sports,sports,45,Gold Steadies as Traders Weigh Next Round of US-Iran Peace Talks,https://www.livemint.com/market/gold-steadies-as-traders-weigh-next-round-of-us-iran-peace-talks-11776724381789.html,2026-04-21T01:28:48+00:00
Mint,Mint • Sports,https://www.livemint.com/sports,sports,46,European Stocks Drop on Worries Over Iran Ceasefire Extension,https://www.livemint.com/market/european-stocks-drop-on-worries-over-iran-ceasefire-extension-11776718556213.html,2026-04-21T01:28:48+00:00
Mint,Mint • Sports,https://www.livemint.com/sports,sports,47,"Wine requests, barred husbands, federal probes: Trump's Labor Secretary DeRemer quits amid misconduct probe",https://www.livemint.com/news/us-news/wine-requests-barred-husbands-federal-probes-trumps-labor-secretary-lori-chavez-deremer-quits-amid-misconduct-probe-11776732093591.html,2026-04-21T01:28:48+00:00
Mint,Mint • Sports,https://www.livemint.com/sports,sports,48,Apple CEO Cook plans his departure. The tech giant he leaves behind won’t be the same.,https://www.livemint.com/news/apple-ceo-cook-plans-his-departure-the-tech-giant-he-leaves-behind-won-t-be-the-same-11776733196758.html,2026-04-21T01:28:48+00:00
Mint,Mint • Sports,https://www.livemint.com/sports,sports,49,How sub-normal rains may affect reservoir levels,https://www.livemint.com/news/how-sub-normal-rains-may-affect-reservoir-levels-monsoon-irrigation-farmers-11776699759521.html,2026-04-21T01:28:48+00:00
Mint,Mint • Sports,https://www.livemint.com/sports,sports,50,"NITI Aayog working on plan to fix e-rickshaw, tempo mess in last-mile travel",https://www.livemint.com/news/niti-aayog-working-on-plan-to-fix-e-rickshaw-tempo-mess-in-last-mile-travel-11776685537501.html,2026-04-21T01:28:48+00:00
Mint,Mint • Sports,https://www.livemint.com/sports,sports,51,"Yesterday GT vs MI, IPL 2026 match result: What happened in Gujarat Titans vs Mumbai Indians clash",https://www.livemint.com/news/trends/yesterday-gt-vs-mi-ipl-2026-match-result-what-happened-in-gujarat-titans-vs-mumbai-indians-april-20-highlights-11776714360208.html,2026-04-21T01:28:48+00:00
Mint,Mint • Sports,https://www.livemint.com/sports,sports,52,‘We will not take blockade off until there is a ‘DEAL’’ — Trump hardens negotiation stance against Iran,https://www.livemint.com/news/us-news/the-blockade-until-there-is-a-deal-trump-hardens-iran-negotiation-stance-11776716378385.html,2026-04-21T01:28:48+00:00
Mint,Mint • Sports,https://www.livemint.com/sports,sports,53,Salary Impact Tracker,https://www.livemint.com/tools-calculators/salary-impact-tracker,2026-04-21T01:28:48+00:00
Mint,Mint • Sports,https://www.livemint.com/sports,sports,54,Mint Explainer | Tata turmoil: A snapshot of simmering tensions at the group,https://www.livemint.com/companies/news/mint-explainer-tata-turmoil-a-snapshot-of-simmering-tensions-at-the-group-11776673760234.html,2026-04-21T01:28:48+00:00
Mint,Mint • Sports,https://www.livemint.com/sports,sports,55,"Pocket FM's microtransactions, AI use in content creation are driving growth, COO Gangwar says",https://www.livemint.com/companies/news/pocket-fm-microtransactions-ai-use-growth-driver-monetization-engine-audio-storytelling-coo-lalit-gangwar-11776686533621.html,2026-04-21T01:28:48+00:00
Mint,Mint • Sports,https://www.livemint.com/sports,sports,56,"After years of distress, Kota's Resonance nears debt deal with 80% haircut",https://www.livemint.com/companies/news/kota-resonance-debt-resolution-test-prep-india-edtech-industry-nclt-bjyus-unacademy-11776659308406.html,2026-04-21T01:28:48+00:00
Mint,Mint • Sports,https://www.livemint.com/sports,sports,57,How Amazon allegedly used Levi's and Hanes to force rivals to raise prices - What California court filing reveals,https://www.livemint.com/companies/news/how-amazon-allegedly-used-levis-and-hanes-to-force-rivals-to-raise-prices-what-california-court-filing-reveals-11776729776097.html,2026-04-21T01:28:48+00:00
Mint,Mint • Sports,https://www.livemint.com/sports,sports,58,"Jio Financial to leverage marketplace for high-risk products, credit cards",https://www.livemint.com/companies/jio-financial-marketplace-high-risk-products-credit-cards-11776685448852.html,2026-04-21T01:28:48+00:00
Mint,Mint • Sports,https://www.livemint.com/sports,sports,59,Who is John Ternus? Net worth of Apple's hardware chief set to replace Tim Cook as CEO,https://www.livemint.com/companies/people/who-is-john-ternus-net-worth-of-apples-hardware-chief-set-to-replace-tim-cook-as-ceo-11776726795904.html,2026-04-21T01:28:48+00:00
Mint,Mint • Sports,https://www.livemint.com/sports,sports,60,Ask Mint Money,https://www.livemint.com/money/ask-mint-money,2026-04-21T01:28:48+00:00
Mint,Mint • Sports,https://www.livemint.com/sports,sports,61,"Digital Gold explained: Here's all you need to know about cost, associated charges, risk and tax liability for the asset",https://www.livemint.com/money/personal-finance/digital-gold-explained-all-you-need-know-about-investment-asset-cost-associated-charges-risk-taxes-liability-regulations-11776704165169.html,2026-04-21T01:28:48+00:00
Mint,Mint • Sports,https://www.livemint.com/sports,sports,62,BHIM App users can now easily track their CIBIL Score. Here's how to do it,https://www.livemint.com/money/personal-finance/bhim-payments-app-integrates-cibil-score-to-boost-credit-awareness-help-users-track-manage-their-financial-h-11776700056824.html,2026-04-21T01:28:48+00:00
Mint,Mint • Sports,https://www.livemint.com/sports,sports,63,"Public provident fund for children: Here's how to open PPF account, contribution limit, withdrawal rules, tax deductions",https://www.livemint.com/money/personal-finance/public-provident-fund-for-children-parents-how-open-ppf-account-contribution-limit-withdrawal-rules-loans-tax-deductions-11776698663683.html,2026-04-21T01:28:48+00:00
Mint,Mint • Sports,https://www.livemint.com/sports,sports,64,"Top investment options in 2026: Compare FD, PPF, Mutual Funds, ELSS and gold — which asset class is right for you?",https://www.livemint.com/money/personal-finance/top-investment-options-in-2026-compare-fd-ppf-mutual-funds-elss-and-gold-which-asset-class-is-right-for-you-11776692753947.html,2026-04-21T01:28:48+00:00
Mint,Mint • Sports,https://www.livemint.com/sports,sports,65,Tax Collected at Source: Here's how changes to TCS rates impact you — check bank charges applicable,https://www.livemint.com/money/personal-finance/tcs-rates-tax-collected-at-source-how-changes-remittances-impact-you-check-icici-hdfc-bank-charges-customers-income-tax-11776689734056.html,2026-04-21T01:28:48+00:00
Mint,Mint • Sports,https://www.livemint.com/sports,sports,66,7 common mutual fund mistakes beginners must avoid in volatile markets,https://www.livemint.com/money/personal-finance/7-common-mutual-fund-mistakes-beginners-must-avoid-in-volatile-markets-11776686696546.html,2026-04-21T01:28:48+00:00
Mint,Mint • Sports,https://www.livemint.com/sports,sports,67,AI transforming journalism; women journos can turn tech shift into opportunities: Brijesh Singh,https://www.livemint.com/technology/ai-transforming-journalism-women-journos-can-turn-tech-shift-into-opportunities-brijesh-singh-11776697861420.html,2026-04-21T01:28:48+00:00
Mint,Mint • Sports,https://www.livemint.com/sports,sports,68,I integrated Google Gemini into my daily workflow and saw real productivity gains,https://www.livemint.com/technology/howusinggoogle-geminidailyimprovedmyproductivity-11776662972570.html,2026-04-21T01:28:48+00:00
Mint,Mint • Sports,https://www.livemint.com/sports,sports,69,"OnePlus Nord CE 6, Nord CE 6 Lite India launch date confirmed, battery, chipset and display details revealed",https://www.livemint.com/technology/gadgets/oneplus-nord-ce-6-nord-ce-6-lite-india-launch-date-confirmed-battery-chipset-and-display-details-revealed-11776672068463.html,2026-04-21T01:28:48+00:00
Mint,Mint • Sports,https://www.livemint.com/sports,sports,70,"How to reverse-engineer the perfect ChatGPT prompt, according to an MIT professor",https://www.livemint.com/technology/tech-news/how-to-reverse-engineer-the-perfect-chatgpt-prompt-according-to-an-mit-professor-gemini-claude-ai-11776662638146.html,2026-04-21T01:28:48+00:00
Mint,Mint • Sports,https://www.livemint.com/sports,sports,71,Has Apple already begun marketing Siri's big overhaul? Check hidden AI clues in WWDC 2026 poster,https://www.livemint.com/technology/tech-news/has-apple-already-begun-marketing-siris-big-overhaul-check-hidden-ai-clues-in-wwdc-2026-poster-11776657964065.html,2026-04-21T01:28:48+00:00
Mint,Mint • Sports,https://www.livemint.com/sports,sports,72,Vercel data leak: CEO confirms internal breach linked to AI tool as hackers claim to sell stolen data for $2 million,https://www.livemint.com/technology/tech-news/vercel-data-leak-ceo-confirms-internal-breach-linked-to-ai-tool-as-hackers-claim-to-sell-stolen-data-for-2-million-11776650683210.html,2026-04-21T01:28:48+00:00
Mint,Mint • Sports,https://www.livemint.com/sports,sports,73,IPL 2026 Schedule,https://www.livemint.com/sports/cricket-news/ipl-schedule,2026-04-21T01:28:48+00:00
Mint,Mint • Sports,https://www.livemint.com/sports,sports,74,Orange Cap in IPL 2026,https://www.livemint.com/sports/cricket-news/ipl-orange-cap,2026-04-21T01:28:48+00:00
Mint,Mint • Sports,https://www.livemint.com/sports,sports,75,Purple Cap in IPL 2026,https://www.livemint.com/sports/cricket-news/ipl-purple-cap,2026-04-21T01:28:48+00:00
Mint,Mint • Sports,https://www.livemint.com/sports,sports,76,IPL 2026 Points Table,https://www.livemint.com/sports/cricket-news/ipl-points-table,2026-04-21T01:28:48+00:00
Mint,Mint • Sports,https://www.livemint.com/sports,sports,77,IFSC Code Finder,https://www.livemint.com/ifsc-code,2026-04-21T01:28:48+00:00
Mint,Mint • Sports,https://www.livemint.com/sports,sports,78,Income Tax Calculator,https://www.livemint.com/tools-calculators/income-tax-calculator,2026-04-21T01:28:48+00:00
Mint,Mint • Sports,https://www.livemint.com/sports,sports,79,Gold Rate Today,https://www.livemint.com/gold-prices,2026-04-21T01:28:48+00:00
Mint,Mint • Sports,https://www.livemint.com/sports,sports,80,Gold Rate in Delhi,https://www.livemint.com/gold-prices/delhi,2026-04-21T01:28:48+00:00
Mint,Mint • Sports,https://www.livemint.com/sports,sports,81,Gold Rate Hyderabad,https://www.livemint.com/gold-prices/hyderabad,2026-04-21T01:28:48+00:00
Mint,Mint • Sports,https://www.livemint.com/sports,sports,82,Silver Rate Today,https://www.livemint.com/silver-prices,2026-04-21T01:28:48+00:00
Mint,Mint • Sports,https://www.livemint.com/sports,sports,83,Silver Rate in Delhi,https://www.livemint.com/silver-prices/delhi,2026-04-21T01:28:48+00:00
Mint,Mint • Sports,https://www.livemint.com/sports,sports,84,Silver Rate in Bangalore,https://www.livemint.com/silver-prices/bangalore,2026-04-21T01:28:48+00:00
Mint,Mint • Sports,https://www.livemint.com/sports,sports,85,US Stock Market,https://www.livemint.com/market/us-market,2026-04-21T01:28:48+00:00
Mint,Mint • Sports,https://www.livemint.com/sports,sports,86,Stock Market Today,https://www.livemint.com/market/stock-market-news/stock-market-sensex-nifty-50-live-updates-gift-nifty-20-april-2026-us-iran-war-crude-oil-prices-gold-rate-today-silver-11776651995951.html,2026-04-21T01:28:48+00:00
Mint,Mint • Sports,https://www.livemint.com/sports,sports,87,MCX Gold Rate,https://www.livemint.com/market/market-stats/commodity-mcx-gold-price,2026-04-21T01:28:48+00:00
Mint,Mint • Sports,https://www.livemint.com/sports,sports,88,MCX Silver Price,https://www.livemint.com/market/market-stats/commodity-mcx-silver-price,2026-04-21T01:28:48+00:00
Mint,Mint • Sports,https://www.livemint.com/sports,sports,89,Gold Price in Mumbai,https://www.livemint.com/gold-prices/mumbai,2026-04-21T01:28:48+00:00
Mint,Mint • Sports,https://www.livemint.com/sports,sports,90,Gold Price in Chennai,https://www.livemint.com/gold-prices/chennai,2026-04-21T01:28:48+00:00
Mint,Mint • Sports,https://www.livemint.com/sports,sports,91,Gold Price in Kolkata,https://www.livemint.com/gold-prices/kolkata,2026-04-21T01:28:48+00:00
Mint,Mint • Sports,https://www.livemint.com/sports,sports,92,Silver Price in Mumbai,https://www.livemint.com/silver-prices/mumbai,2026-04-21T01:28:48+00:00
Mint,Mint • Sports,https://www.livemint.com/sports,sports,93,Silver Price in Chennai,https://www.livemint.com/silver-prices/chennai,2026-04-21T01:28:48+00:00
Mint,Mint • Sports,https://www.livemint.com/sports,sports,94,Silver Price in Hyderabad,https://www.livemint.com/silver-prices/hyderabad,2026-04-21T01:28:48+00:00
Mint,Mint • Sports,https://www.livemint.com/sports,sports,95,Silver Price in Kolkata,https://www.livemint.com/silver-prices/kolkata,2026-04-21T01:28:48+00:00
Mint,Mint • Sports,https://www.livemint.com/sports,sports,96,Latest News Today,https://www.livemint.com/news,2026-04-21T01:28:48+00:00
Mint,Mint • Sports,https://www.livemint.com/sports,sports,97,US News Today,https://www.livemint.com/news/us-news,2026-04-21T01:28:48+00:00
Mint,Mint • Sports,https://www.livemint.com/sports,sports,98,Top Company Leader,https://www.livemint.com/companies/people,2026-04-21T01:28:48+00:00
Mint,Mint • Sports,https://www.livemint.com/sports,sports,99,personal loan emi calculator,https://www.livemint.com/loans/personal-loan-emi-calculator,2026-04-21T01:28:48+00:00
Mint,Mint • Sports,https://www.livemint.com/sports,sports,100,Personal Loan Interest Rate,https://www.livemint.com/loans/personal-loan-interest-rates,2026-04-21T01:28:48+00:00
Mint,Mint • Sports,https://www.livemint.com/sports,sports,101,Personal Loan Eligibility,https://www.livemint.com/loans/personal-loan-eligibility,2026-04-21T01:28:48+00:00
Mint,Mint • Sports,https://www.livemint.com/sports,sports,102,Instant Personal Loan,https://www.livemint.com/loans/instant-personal-loan,2026-04-21T01:28:48+00:00
Mint,Mint • Sports,https://www.livemint.com/sports,sports,103,Home Loan EMI Calculator,https://www.livemint.com/tools-calculators/home-loan-emi-calculator,2026-04-21T01:28:48+00:00
Mint,Mint • Sports,https://www.livemint.com/sports,sports,104,Car Loan EMI,https://www.livemint.com/tools-calculators/car-loan-calculator,2026-04-21T01:28:48+00:00
