publisher,source,source_url,category,rank,headline,link,collected_at_iso
Economic Times,Economic Times • Markets,https://economictimes.indiatimes.com/markets,markets,1,These large-caps have ‘strong buy’ & ‘buy’ recos and an upside potential of up to 25%,https://economictimes.indiatimes.com/articleshow/130404921.cms,2026-04-21T01:28:48+00:00
Economic Times,Economic Times • Markets,https://economictimes.indiatimes.com/markets,markets,2,Weekly Top Picks: These stocks scored 10 on 10 on Stock Reports Plus,https://economictimes.indiatimes.com/articleshow/130393260.cms,2026-04-21T01:28:48+00:00
Economic Times,Economic Times • Markets,https://economictimes.indiatimes.com/markets,markets,3,Stock picks of the week: 5 stocks with consistent score improvement and upside potential of up to 33%,https://economictimes.indiatimes.com/articleshow/130384546.cms,2026-04-21T01:28:48+00:00
Economic Times,Economic Times • Markets,https://economictimes.indiatimes.com/markets,markets,4,Stock Radar: Precision Wires stock hits fresh record high in April; breaks out from 1-month consolidation,https://economictimes.indiatimes.com/articleshow/130393966.cms,2026-04-21T01:28:48+00:00
Economic Times,Economic Times • Markets,https://economictimes.indiatimes.com/markets,markets,5,"US Stock Market: US stocks closes slightly down on renewed tensions between US, Iran",https://economictimes.indiatimes.com/articleshow/130402320.cms,2026-04-21T01:28:48+00:00
Economic Times,Economic Times • Markets,https://economictimes.indiatimes.com/markets,markets,6,Wall Street regulators jointly propose to trim Biden-era private fund reporting rules,https://economictimes.indiatimes.com/articleshow/130402009.cms,2026-04-21T01:28:48+00:00
Economic Times,Economic Times • Markets,https://economictimes.indiatimes.com/markets,markets,7,Fermi stock drops sharply after CEO and CFO departures,https://economictimes.indiatimes.com/articleshow/130400111.cms,2026-04-21T01:28:48+00:00
Economic Times,Economic Times • Markets,https://economictimes.indiatimes.com/markets,markets,8,"US Fed nominee Warsh commits to central bank's independence, with limits",https://economictimes.indiatimes.com/articleshow/130399521.cms,2026-04-21T01:28:48+00:00
Economic Times,Economic Times • Markets,https://economictimes.indiatimes.com/markets,markets,9,Honeywell to sell productivity solutions unit to Brady for $1.4 billion,https://economictimes.indiatimes.com/articleshow/130398243.cms,2026-04-21T01:28:48+00:00
Economic Times,Economic Times • Markets,https://economictimes.indiatimes.com/markets,markets,10,"BSE launches Housing Finance Index to track sectoral opportunities, enable passive investing",https://economictimes.indiatimes.com/articleshow/130397312.cms,2026-04-21T01:28:48+00:00
Economic Times,Economic Times • Markets,https://economictimes.indiatimes.com/markets,markets,11,PNB Housing Finance Q4 profit surges 19% to Rs 656 crore with strong retail growth,https://economictimes.indiatimes.com/articleshow/130397271.cms,2026-04-21T01:28:48+00:00
Economic Times,Economic Times • Markets,https://economictimes.indiatimes.com/markets,markets,12,Market Trading Guide: Buy CESC and Trent on Tuesday for near term gains up to 9%,https://economictimes.indiatimes.com/articleshow/130396191.cms,2026-04-21T01:28:48+00:00
Economic Times,Economic Times • Markets,https://economictimes.indiatimes.com/markets,markets,13,US Stocks: Marvell shares jump 5% on report of deal talks with Google to develop two AI chips,https://economictimes.indiatimes.com/articleshow/130395166.cms,2026-04-21T01:28:48+00:00
Economic Times,Economic Times • Markets,https://economictimes.indiatimes.com/markets,markets,14,US stocks: Adobe shares rises after it launches AI suite for corporate clients as competition heats up,https://economictimes.indiatimes.com/articleshow/130395072.cms,2026-04-21T01:28:48+00:00
Economic Times,Economic Times • Markets,https://economictimes.indiatimes.com/markets,markets,15,"Two Trades for Today: An auto major for a 4.25% rise, a mid-cap EV 2-wheeler stock for a gain of almost 6.5%",https://economictimes.indiatimes.com/articleshow/130394055.cms,2026-04-21T01:28:48+00:00
Economic Times,Economic Times • Markets,https://economictimes.indiatimes.com/markets,markets,16,"US stocks today: S&P 500, Nasdaq retreat as mounting U.S.-Iran tensions dampen sentiment",https://economictimes.indiatimes.com/articleshow/130394115.cms,2026-04-21T01:28:48+00:00
Economic Times,Economic Times • Markets,https://economictimes.indiatimes.com/markets,markets,17,Quote of the day by Warren Buffett: “You should never test the depth of the water with both feet.”,https://economictimes.indiatimes.com/articleshow/130392308.cms,2026-04-21T01:28:48+00:00
Economic Times,Economic Times • Markets,https://economictimes.indiatimes.com/markets,markets,18,India bonds edge up in choppy session as traders weigh truce prospects,https://economictimes.indiatimes.com/articleshow/130391908.cms,2026-04-21T01:28:48+00:00
Economic Times,Economic Times • Markets,https://economictimes.indiatimes.com/markets,markets,19,"BPTP to invest Rs 1,100 cr to build luxury homes in Haryana's Faridabad",https://economictimes.indiatimes.com/articleshow/130391845.cms,2026-04-21T01:28:48+00:00
Economic Times,Economic Times • Markets,https://economictimes.indiatimes.com/markets,markets,20,Pernod Ricard is said to begin IPO process for India unit,https://economictimes.indiatimes.com/articleshow/130390148.cms,2026-04-21T01:28:48+00:00
Economic Times,Economic Times • Markets,https://economictimes.indiatimes.com/markets,markets,21,Rupee falls most in a week as traders brace for US-Iran ceasefire expiry,https://economictimes.indiatimes.com/articleshow/130390059.cms,2026-04-21T01:28:48+00:00
Economic Times,Economic Times • Markets,https://economictimes.indiatimes.com/markets,markets,22,Euro zone yields nudge higher on US-Iran ceasefire worries,https://economictimes.indiatimes.com/articleshow/130390014.cms,2026-04-21T01:28:48+00:00
Economic Times,Economic Times • Markets,https://economictimes.indiatimes.com/markets,markets,23,Oil prices rise 5% on fears of US-Iran ceasefire collapse,https://economictimes.indiatimes.com/articleshow/130389965.cms,2026-04-21T01:28:48+00:00
Economic Times,Economic Times • Markets,https://economictimes.indiatimes.com/markets,markets,24,"Bank of Maharashtra Q4 Results: Net profit jumps 34% YoY to Rs 2,014 crore; NII up 20%",https://economictimes.indiatimes.com/articleshow/130389579.cms,2026-04-21T01:28:48+00:00
Economic Times,Economic Times • Markets,https://economictimes.indiatimes.com/markets,markets,25,Fed nominee Warsh prepares for monetary policy road test before Senate panel,https://economictimes.indiatimes.com/articleshow/130389311.cms,2026-04-21T01:28:48+00:00
Economic Times,Economic Times • Markets,https://economictimes.indiatimes.com/markets,markets,26,Adani Power eclipses Adani Ports to becomes Group’s most valuable stock with m-cap Rs 3.99 lakh crore,https://economictimes.indiatimes.com/articleshow/130389053.cms,2026-04-21T01:28:48+00:00
Economic Times,Economic Times • Markets,https://economictimes.indiatimes.com/markets,markets,27,Global Markets | European shares slide as Middle East ceasefire hangs in balance,https://economictimes.indiatimes.com/articleshow/130388430.cms,2026-04-21T01:28:48+00:00
Economic Times,Economic Times • Markets,https://economictimes.indiatimes.com/markets,markets,28,Global Markets | Japan's Nikkei climbs as AI optimism outweighs Mideast concerns,https://economictimes.indiatimes.com/articleshow/130387901.cms,2026-04-21T01:28:48+00:00
Economic Times,Economic Times • Markets,https://economictimes.indiatimes.com/markets,markets,29,Deccan Gold Mines shares rally 16% on India’s first private gold mining project. Check details,https://economictimes.indiatimes.com/articleshow/130387076.cms,2026-04-21T01:28:48+00:00
Economic Times,Economic Times • Markets,https://economictimes.indiatimes.com/markets,markets,30,"SW Solar shares rally 17% after Rs 3,500 crore order from Coal India. Check details",https://economictimes.indiatimes.com/articleshow/130386399.cms,2026-04-21T01:28:48+00:00
Economic Times,Economic Times • Markets,https://economictimes.indiatimes.com/markets,markets,31,"Groww Q4 Results: Profit soars 122% YoY to Rs 686 crore, cashing in on market crash and Iran war",https://economictimes.indiatimes.com/articleshow/130386122.cms,2026-04-21T01:28:48+00:00
Economic Times,Economic Times • Markets,https://economictimes.indiatimes.com/markets,markets,32,Lenskart shares tumble 5% amid online backlash over dress code row,https://economictimes.indiatimes.com/articleshow/130385860.cms,2026-04-21T01:28:48+00:00
Economic Times,Economic Times • Markets,https://economictimes.indiatimes.com/markets,markets,33,"Why is stock market rising today? Sensex jumps 400 points, Nifty above 24,450. 4 key factors explained",https://economictimes.indiatimes.com/articleshow/130385841.cms,2026-04-21T01:28:48+00:00
Economic Times,Economic Times • Markets,https://economictimes.indiatimes.com/markets,markets,34,JPMorgan finds Reliance Industries share valuation comfortable but flags O2C as uncertain spot,https://economictimes.indiatimes.com/articleshow/130382645.cms,2026-04-21T01:28:48+00:00
Economic Times,Economic Times • Markets,https://economictimes.indiatimes.com/markets,markets,35,Global Markets | Australian shares end largely unchanged as investors remain wary of Mideast risks,https://economictimes.indiatimes.com/articleshow/130385491.cms,2026-04-21T01:28:48+00:00
Economic Times,Economic Times • Markets,https://economictimes.indiatimes.com/markets,markets,36,"Angel One shares drop 2% as JM Financial downgraded the stock following Q4 results. Should you buy, sell or hold?",https://economictimes.indiatimes.com/articleshow/130385433.cms,2026-04-21T01:28:48+00:00
Economic Times,Economic Times • Markets,https://economictimes.indiatimes.com/markets,markets,37,Trent shares jump 4% ahead of board meet to consider bonus issue on April 22,https://economictimes.indiatimes.com/articleshow/130384879.cms,2026-04-21T01:28:48+00:00
Economic Times,Economic Times • Markets,https://economictimes.indiatimes.com/markets,markets,38,Suzlon Energy shares drop 2% after 35% rally in April so far. Should you buy?,https://economictimes.indiatimes.com/articleshow/130384566.cms,2026-04-21T01:28:48+00:00
Economic Times,Economic Times • Markets,https://economictimes.indiatimes.com/markets,markets,39,Mixed geopolitical signals making market moves hard to decode: Seth R Freeman,https://economictimes.indiatimes.com/articleshow/130384112.cms,2026-04-21T01:28:48+00:00
Economic Times,Economic Times • Markets,https://economictimes.indiatimes.com/markets,markets,40,HDFC Bank vs ICICI Bank vs YES Bank: Which one to buy after Q4 results?,https://economictimes.indiatimes.com/articleshow/130383888.cms,2026-04-21T01:28:48+00:00
Economic Times,Economic Times • Markets,https://economictimes.indiatimes.com/markets,markets,41,BHEL shares rally 5% after reporting 18% YoY rise in FY26 provisional turnover,https://economictimes.indiatimes.com/articleshow/130383831.cms,2026-04-21T01:28:48+00:00
Economic Times,Economic Times • Markets,https://economictimes.indiatimes.com/markets,markets,42,"Where to invest now: Chemicals, capital goods, and banking top the list, says Aditya Shah",https://economictimes.indiatimes.com/articleshow/130383774.cms,2026-04-21T01:28:48+00:00
Economic Times,Economic Times • Markets,https://economictimes.indiatimes.com/markets,markets,43,Apollo Micro Systems shares jump 23% in 2 days after securing arms manufacturing licence,https://economictimes.indiatimes.com/articleshow/130383424.cms,2026-04-21T01:28:48+00:00
Economic Times,Economic Times • Markets,https://economictimes.indiatimes.com/markets,markets,44,Adani Power shares jump 3% to fresh 52-week high as firm expands nuclear energy ambitions,https://economictimes.indiatimes.com/articleshow/130383329.cms,2026-04-21T01:28:48+00:00
Economic Times,Economic Times • Markets,https://economictimes.indiatimes.com/markets,markets,45,Global Markets: Uncertain global outlook keeps investors balancing risk and opportunity,https://economictimes.indiatimes.com/articleshow/130383279.cms,2026-04-21T01:28:48+00:00
Economic Times,Economic Times • Markets,https://economictimes.indiatimes.com/markets,markets,46,Rajesh Palviya sees Nifty rally extending this week on strong bullish momentum,https://economictimes.indiatimes.com/articleshow/130383167.cms,2026-04-21T01:28:48+00:00
Economic Times,Economic Times • Markets,https://economictimes.indiatimes.com/markets,markets,47,US Stock Market: Global investors pivot back to US market amid strong earnings and easing tensions,https://economictimes.indiatimes.com/articleshow/130383069.cms,2026-04-21T01:28:48+00:00
Economic Times,Economic Times • Markets,https://economictimes.indiatimes.com/markets,markets,48,"Sector rotation underway: 3 themes to watch for your portfolio, says Devang Mehta",https://economictimes.indiatimes.com/articleshow/130382974.cms,2026-04-21T01:28:48+00:00
Economic Times,Economic Times • Markets,https://economictimes.indiatimes.com/markets,markets,49,"Groww, world’s most expensive broking stock, to face earnings test today after doubling from IPO price",https://economictimes.indiatimes.com/articleshow/130382835.cms,2026-04-21T01:28:48+00:00
Economic Times,Economic Times • Markets,https://economictimes.indiatimes.com/markets,markets,50,"HDFC Bank shares fall over 1% after Q4. Jefferies, Bernstein, 3 other brokerage weigh in",https://economictimes.indiatimes.com/articleshow/130382746.cms,2026-04-21T01:28:48+00:00
Economic Times,Economic Times • Markets,https://economictimes.indiatimes.com/markets,markets,51,MCX gets Sebi nod to start coal exchange subsidiary,https://economictimes.indiatimes.com/articleshow/130382703.cms,2026-04-21T01:28:48+00:00
Economic Times,Economic Times • Markets,https://economictimes.indiatimes.com/markets,markets,52,Investors pile into US stocks as 'TINA' revival knocks 'TIARA' trades,https://economictimes.indiatimes.com/articleshow/130382609.cms,2026-04-21T01:28:48+00:00
Economic Times,Economic Times • Markets,https://economictimes.indiatimes.com/markets,markets,53,Is the RBI fighting the wrong battle? Why rate hikes may not solve India’s current inflation problem,https://economictimes.indiatimes.com/articleshow/130382575.cms,2026-04-21T01:28:48+00:00
Economic Times,Economic Times • Markets,https://economictimes.indiatimes.com/markets,markets,54,US Stock Market: Goldman sticks to oil forecast as demand weakness deepens,https://economictimes.indiatimes.com/articleshow/130382421.cms,2026-04-21T01:28:48+00:00
Economic Times,Economic Times • Markets,https://economictimes.indiatimes.com/markets,markets,55,"Yes Bank shares jump 3% after Q4 earnings beat estimates. Here's what Morgan Stanley, other brokerages say",https://economictimes.indiatimes.com/articleshow/130382395.cms,2026-04-21T01:28:48+00:00
Economic Times,Economic Times • Markets,https://economictimes.indiatimes.com/markets,markets,56,"Silver tanks nearly Rs 4,000, gold slips Rs 1,600 as Strait of Hormuz tensions reignite inflation fears. Time to sell?",https://economictimes.indiatimes.com/articleshow/130382170.cms,2026-04-21T01:28:48+00:00
Economic Times,Economic Times • Markets,https://economictimes.indiatimes.com/markets,markets,57,"ICICI Bank shares rise 2% after Q4 results. What Jefferies, Bernstein and other brokerages are saying",https://economictimes.indiatimes.com/articleshow/130382097.cms,2026-04-21T01:28:48+00:00
Economic Times,Economic Times • Markets,https://economictimes.indiatimes.com/markets,markets,58,US Stock Market: Investors turn to corporate earnings for clues on future market direction,https://economictimes.indiatimes.com/articleshow/130382044.cms,2026-04-21T01:28:48+00:00
Economic Times,Economic Times • Markets,https://economictimes.indiatimes.com/markets,markets,59,"Sensex settles with marginal gains, Nifty closes above 24,350 as Iran-US war escalations keep sentiment fragile",https://economictimes.indiatimes.com/articleshow/130381954.cms,2026-04-21T01:28:48+00:00
Economic Times,Economic Times • Markets,https://economictimes.indiatimes.com/markets,markets,60,BSE vs IEX vs MCX: Which exchange's shares should you buy now?,https://economictimes.indiatimes.com/articleshow/130382012.cms,2026-04-21T01:28:48+00:00
Economic Times,Economic Times • Markets,https://economictimes.indiatimes.com/markets,markets,61,FIIs bought 120 Indian stocks in Q4 amid Rs 1.3 lakh crore exodus. What's special about them?,https://economictimes.indiatimes.com/articleshow/130381981.cms,2026-04-21T01:28:48+00:00
Economic Times,Economic Times • Markets,https://economictimes.indiatimes.com/markets,markets,62,IEX shares plunge over 6% after CERC's latest update on market coupling norms. Check details,https://economictimes.indiatimes.com/articleshow/130381951.cms,2026-04-21T01:28:48+00:00
Economic Times,Economic Times • Markets,https://economictimes.indiatimes.com/markets,markets,63,Top Nifty50 stocks analysts suggest buying in this volatile week,https://economictimes.indiatimes.com/articleshow/130381779.cms,2026-04-21T01:28:48+00:00
Economic Times,Economic Times • Markets,https://economictimes.indiatimes.com/markets,markets,64,Global Markets | Japan's Nikkei climbs as AI optimism outweighs Mideast concerns,https://economictimes.indiatimes.com/articleshow/130381814.cms,2026-04-21T01:28:48+00:00
Economic Times,Economic Times • Markets,https://economictimes.indiatimes.com/markets,markets,65,"Wipro’s Rs 15,000 crore share buyback: Should you participate or avoid?",https://economictimes.indiatimes.com/articleshow/130381796.cms,2026-04-21T01:28:48+00:00
Economic Times,Economic Times • Markets,https://economictimes.indiatimes.com/markets,markets,66,"Jio Financial Services shares dip 3% as Q4 profit declines 14% YoY, but revenue soars 106%.",https://economictimes.indiatimes.com/articleshow/130381746.cms,2026-04-21T01:28:48+00:00
Economic Times,Economic Times • Markets,https://economictimes.indiatimes.com/markets,markets,67,Smallcap stocks skyrocket up to 79% after crash. Is this breakout rally or bull trap?,https://economictimes.indiatimes.com/articleshow/130381687.cms,2026-04-21T01:28:48+00:00
Economic Times,Economic Times • Markets,https://economictimes.indiatimes.com/markets,markets,68,Stock Radar: Breakout from a falling trendline makes Tata Power stock an attractive buy; hits fresh 52-week high in April,https://economictimes.indiatimes.com/articleshow/130381219.cms,2026-04-21T01:28:48+00:00
Economic Times,Economic Times • Markets,https://economictimes.indiatimes.com/markets,markets,69,Pre-market action: Here's the trade setup for today's session,https://economictimes.indiatimes.com/articleshow/130405038.cms,2026-04-21T01:28:48+00:00
Economic Times,Economic Times • Markets,https://economictimes.indiatimes.com/markets,markets,70,"ICICI up, HDFC down after Q4 show; analysts positive",https://economictimes.indiatimes.com/articleshow/130404897.cms,2026-04-21T01:28:48+00:00
Economic Times,Economic Times • Markets,https://economictimes.indiatimes.com/markets,markets,71,"After direct push, Jio BlackRock taps distributors for growth",https://economictimes.indiatimes.com/articleshow/130404868.cms,2026-04-21T01:28:48+00:00
Economic Times,Economic Times • Markets,https://economictimes.indiatimes.com/markets,markets,72,"Stocks in news: HCL Tech, Vedanta, Jio Financial, IndusInd & Suzlon Energy",https://economictimes.indiatimes.com/articleshow/130405003.cms,2026-04-21T01:28:48+00:00
Economic Times,Economic Times • Markets,https://economictimes.indiatimes.com/markets,markets,73,India Inc borrowed $4.6 billion from overseas mkts in Feb,https://economictimes.indiatimes.com/articleshow/130397195.cms,2026-04-21T01:28:48+00:00
Economic Times,Economic Times • Markets,https://economictimes.indiatimes.com/markets,markets,74,The Gold Edge: ETF net inflows up 4.5 times in FY26,https://economictimes.indiatimes.com/articleshow/130404928.cms,2026-04-21T01:28:48+00:00
Economic Times,Economic Times • Markets,https://economictimes.indiatimes.com/markets,markets,75,"NSE IPO can unlock Rs 12,000 crore for PSU insurers, boost solvency ratios",https://economictimes.indiatimes.com/articleshow/130404875.cms,2026-04-21T01:28:48+00:00
Economic Times,Economic Times • Markets,https://economictimes.indiatimes.com/markets,markets,76,Bitcoin strongest since February amid mid-east hopes,https://economictimes.indiatimes.com/articleshow/130404975.cms,2026-04-21T01:28:48+00:00
Economic Times,Economic Times • Markets,https://economictimes.indiatimes.com/markets,markets,77,"Asian stocks gain, oil dips on hopes of Iran talks",https://economictimes.indiatimes.com/articleshow/130405064.cms,2026-04-21T01:28:48+00:00
Economic Times,Economic Times • Markets,https://economictimes.indiatimes.com/markets,markets,78,"Jio Financial to scale lending, holds off unsecured credit",https://economictimes.indiatimes.com/articleshow/130404884.cms,2026-04-21T01:28:48+00:00
Economic Times,Economic Times • Markets,https://economictimes.indiatimes.com/markets,markets,79,RBI to remain nimble to prevent persistent supply shock,https://economictimes.indiatimes.com/articleshow/130404824.cms,2026-04-21T01:28:48+00:00
Economic Times,Economic Times • Markets,https://economictimes.indiatimes.com/markets,markets,80,Bank of Maharashtra net rises 35% on robust loan growth,https://economictimes.indiatimes.com/articleshow/130404945.cms,2026-04-21T01:28:48+00:00
Economic Times,Economic Times • Markets,https://economictimes.indiatimes.com/markets,markets,81,Commodity traders now cozy up to Trump,https://economictimes.indiatimes.com/articleshow/130404992.cms,2026-04-21T01:28:48+00:00
Economic Times,Economic Times • Markets,https://economictimes.indiatimes.com/markets,markets,82,10 things that will decide Dalal Street action on Tuesday,https://economictimes.indiatimes.com/articleshow/130396881.cms,2026-04-21T01:28:48+00:00
Economic Times,Economic Times • Markets,https://economictimes.indiatimes.com/markets,markets,83,HCL Tech Q4 Preview: Can IT co surprise investors?,https://economictimes.indiatimes.com/articleshow/130383172.cms,2026-04-21T01:28:48+00:00
Economic Times,Economic Times • Markets,https://economictimes.indiatimes.com/markets,markets,84,Vedanta announces record date for company's demerger,https://economictimes.indiatimes.com/articleshow/130392744.cms,2026-04-21T01:28:48+00:00
Economic Times,Economic Times • Markets,https://economictimes.indiatimes.com/markets,markets,85,Planning Rs 1 cr corpus? How to optimize your MF folio,https://economictimes.indiatimes.com/articleshow/130386984.cms,2026-04-21T01:28:48+00:00
Economic Times,Economic Times • Markets,https://economictimes.indiatimes.com/markets,markets,86,"Mkt near bottom, but volatility not over: Sunil Subramaniam",https://economictimes.indiatimes.com/articleshow/130386133.cms,2026-04-21T01:28:48+00:00
Economic Times,Economic Times • Markets,https://economictimes.indiatimes.com/markets,markets,87,RIL to announce dividend: How it rewarded investors,https://economictimes.indiatimes.com/articleshow/130382783.cms,2026-04-21T01:28:48+00:00
Economic Times,Economic Times • Markets,https://economictimes.indiatimes.com/markets,markets,88,"Apple names insider John Ternus as CEO, Cook to become executive chairman",https://economictimes.indiatimes.com/articleshow/130405071.cms,2026-04-21T01:28:48+00:00
Economic Times,Economic Times • Markets,https://economictimes.indiatimes.com/markets,markets,89,2 trading calls for near-term gains,https://economictimes.indiatimes.com/articleshow/130389187.cms,2026-04-21T01:28:48+00:00
Economic Times,Economic Times • Markets,https://economictimes.indiatimes.com/markets,markets,90,Smallcaps to beat largecaps for next 5 yrs,https://economictimes.indiatimes.com/articleshow/130387635.cms,2026-04-21T01:28:48+00:00
Economic Times,Economic Times • Markets,https://economictimes.indiatimes.com/markets,markets,91,ICICI’s provisions drop shows strength,https://economictimes.indiatimes.com/articleshow/130384639.cms,2026-04-21T01:28:48+00:00
Economic Times,Economic Times • Markets,https://economictimes.indiatimes.com/markets,markets,92,"In times of war: Take a risk or manage it; different, yet same. 6 small-caps from different sectors with upside potential of up to 29%",https://economictimes.indiatimes.com/articleshow/130365231.cms,2026-04-21T01:28:48+00:00
Economic Times,Economic Times • Markets,https://economictimes.indiatimes.com/markets,markets,93,Tactical investing: 6 stocks for your watchlist as the Gulf rebuild approaches; 4 with positive upside potential of up to 25%,https://economictimes.indiatimes.com/articleshow/130368272.cms,2026-04-21T01:28:48+00:00
Economic Times,Economic Times • Markets,https://economictimes.indiatimes.com/markets,markets,94,The off-balance sheet trick didn’t die in 2019: How Indian managements still hide obligations from investors,https://economictimes.indiatimes.com/articleshow/130336781.cms,2026-04-21T01:28:48+00:00
Economic Times,Economic Times • Markets,https://economictimes.indiatimes.com/markets,markets,95,"The Buffett framework of investing: Why some stocks deserve a PE of 25, and others deserve a PE of 10",https://economictimes.indiatimes.com/articleshow/130350673.cms,2026-04-21T01:28:48+00:00
Economic Times,Economic Times • Markets,https://economictimes.indiatimes.com/markets,markets,96,"These large- and mid-cap stocks can give more than 25% return in 1 year, according to analysts",https://economictimes.indiatimes.com/articleshow/130320279.cms,2026-04-21T01:28:48+00:00
