publisher,source,source_url,category,rank,headline,link,collected_at_iso
Economic Times,Economic Times • Markets,https://economictimes.indiatimes.com/markets,markets,1,GMDC shares rocket 18% to new 52-week high. What’s triggering the sharp surge?,https://economictimes.indiatimes.com/articleshow/130300056.cms,2026-04-16T07:19:48+00:00
Economic Times,Economic Times • Markets,https://economictimes.indiatimes.com/markets,markets,2,"Coal India, NMDC emerge as must-watch mining plays as spot prices surge, says Motilal Oswal's Siddhartha Khemka",https://economictimes.indiatimes.com/articleshow/130299888.cms,2026-04-16T07:19:48+00:00
Economic Times,Economic Times • Markets,https://economictimes.indiatimes.com/markets,markets,3,F&O Radar: Bull Call Spread strategy for Siemens,https://economictimes.indiatimes.com/articleshow/130299543.cms,2026-04-16T07:19:48+00:00
Economic Times,Economic Times • Markets,https://economictimes.indiatimes.com/markets,markets,4,"Volatility expectations, hedging costs ease as Mideast hopes bolster RBI's rupee steps",https://economictimes.indiatimes.com/articleshow/130299035.cms,2026-04-16T07:19:48+00:00
Economic Times,Economic Times • Markets,https://economictimes.indiatimes.com/markets,markets,5,ETMarkets AIF Talk| Performing credit emerges as core portfolio allocation for investors: Amit Dharod,https://economictimes.indiatimes.com/articleshow/130298905.cms,2026-04-16T07:19:48+00:00
Economic Times,Economic Times • Markets,https://economictimes.indiatimes.com/markets,markets,6,"HDB Financial shares rally 12%. What Jefferies, Morgan Stanley analysts recommend",https://economictimes.indiatimes.com/articleshow/130298801.cms,2026-04-16T07:19:48+00:00
Economic Times,Economic Times • Markets,https://economictimes.indiatimes.com/markets,markets,7,ETMarkets Smart Talk | AI boom driving Indian family offices to global markets; US offers richer playbook: Amit Goel,https://economictimes.indiatimes.com/articleshow/130298612.cms,2026-04-16T07:19:48+00:00
Economic Times,Economic Times • Markets,https://economictimes.indiatimes.com/markets,markets,8,Global exchange operators no match to multibagger MCX's 150% returns. What is keeping investors hooked?,https://economictimes.indiatimes.com/articleshow/130298103.cms,2026-04-16T07:19:48+00:00
Economic Times,Economic Times • Markets,https://economictimes.indiatimes.com/markets,markets,9,"Indian bonds retreat after previous rally; focus on debt sale, US-Iran peace talks",https://economictimes.indiatimes.com/articleshow/130297854.cms,2026-04-16T07:19:48+00:00
Economic Times,Economic Times • Markets,https://economictimes.indiatimes.com/markets,markets,10,"Silver rises Rs 4,000, gold up Rs 800 on Iran peace talk hopes, soft dollar spurs demand. Should you buy?",https://economictimes.indiatimes.com/articleshow/130297825.cms,2026-04-16T07:19:48+00:00
Economic Times,Economic Times • Markets,https://economictimes.indiatimes.com/markets,markets,11,Global Market Updates | Japan stocks draw record foreign inflows on optimism over US-Iran resolution,https://economictimes.indiatimes.com/articleshow/130297640.cms,2026-04-16T07:19:48+00:00
Economic Times,Economic Times • Markets,https://economictimes.indiatimes.com/markets,markets,12,"Om Power Transmission IPO allotment: How to check status online, GMP, and listing outlook",https://economictimes.indiatimes.com/articleshow/130297351.cms,2026-04-16T07:19:48+00:00
Economic Times,Economic Times • Markets,https://economictimes.indiatimes.com/markets,markets,13,"GMR Airports shares in focus after firm reports muted Q4 traffic growth, cites multiple headwinds",https://economictimes.indiatimes.com/articleshow/130297138.cms,2026-04-16T07:19:48+00:00
Economic Times,Economic Times • Markets,https://economictimes.indiatimes.com/markets,markets,14,"ICICI Lombard General Insurance shares in focus after Q4 net profit rises 7%. What are Morgan Stanley, HDFC Securities saying?",https://economictimes.indiatimes.com/articleshow/130297002.cms,2026-04-16T07:19:48+00:00
Economic Times,Economic Times • Markets,https://economictimes.indiatimes.com/markets,markets,15,"Gold gains on softer dollar, markets eye US-Iran developments",https://economictimes.indiatimes.com/articleshow/130296566.cms,2026-04-16T07:19:48+00:00
Economic Times,Economic Times • Markets,https://economictimes.indiatimes.com/markets,markets,16,Buyback alert! Last date to buy Aurobindo Pharma shares for Rs 800-crore share buyback. Check details,https://economictimes.indiatimes.com/articleshow/130296550.cms,2026-04-16T07:19:48+00:00
Economic Times,Economic Times • Markets,https://economictimes.indiatimes.com/markets,markets,17,Wipro set to announce buyback today: What to expect,https://economictimes.indiatimes.com/articleshow/130296288.cms,2026-04-16T07:19:48+00:00
Economic Times,Economic Times • Markets,https://economictimes.indiatimes.com/markets,markets,18,"AMC seeks to go first with Rs 1,000-cr bond issue",https://economictimes.indiatimes.com/articleshow/130296008.cms,2026-04-16T07:19:48+00:00
Economic Times,Economic Times • Markets,https://economictimes.indiatimes.com/markets,markets,19,Come wedding season and jewellery stocks do the Jig,https://economictimes.indiatimes.com/articleshow/130295951.cms,2026-04-16T07:19:48+00:00
Economic Times,Economic Times • Markets,https://economictimes.indiatimes.com/markets,markets,20,Oil prices fall as hopes for US-Iran deal outweigh supply disruption concerns,https://economictimes.indiatimes.com/articleshow/130295881.cms,2026-04-16T07:19:48+00:00
Economic Times,Economic Times • Markets,https://economictimes.indiatimes.com/markets,markets,21,"US stocks hit records, oil steadies as Trump says Iran war 'close to over'",https://economictimes.indiatimes.com/articleshow/130295847.cms,2026-04-16T07:19:48+00:00
Economic Times,Economic Times • Markets,https://economictimes.indiatimes.com/markets,markets,22,Oil prices fall as hopes for US-Iran deal outweigh supply disruption concerns,https://economictimes.indiatimes.com/articleshow/130295779.cms,2026-04-16T07:19:48+00:00
Economic Times,Economic Times • Markets,https://economictimes.indiatimes.com/markets,markets,23,GIFT Nifty signals a positive start; here’s the trading setup for the day,https://economictimes.indiatimes.com/articleshow/130295545.cms,2026-04-16T07:19:48+00:00
Economic Times,Economic Times • Markets,https://economictimes.indiatimes.com/markets,markets,24,MF bulls vs FII bears: A Rs 38K cr battle for 5 popular bank stocks,https://economictimes.indiatimes.com/articleshow/130297182.cms,2026-04-16T07:19:48+00:00
Economic Times,Economic Times • Markets,https://economictimes.indiatimes.com/markets,markets,25,Suzlon Energy shares rally 20% in one month: Here's why,https://economictimes.indiatimes.com/articleshow/130299464.cms,2026-04-16T07:19:48+00:00
Economic Times,Economic Times • Markets,https://economictimes.indiatimes.com/markets,markets,26,War or No War! 5 ways to make money in volatile market,https://economictimes.indiatimes.com/articleshow/130297632.cms,2026-04-16T07:19:48+00:00
Economic Times,Economic Times • Markets,https://economictimes.indiatimes.com/markets,markets,27,Who was Mark Mobius and why was he called ‘Indiana Jones of emerging mkts’,https://economictimes.indiatimes.com/articleshow/130299025.cms,2026-04-16T07:19:48+00:00
Economic Times,Economic Times • Markets,https://economictimes.indiatimes.com/markets,markets,28,RailTel Corp shares rocket 25% in just two days! Here's why,https://economictimes.indiatimes.com/articleshow/130297729.cms,2026-04-16T07:19:48+00:00
Economic Times,Economic Times • Markets,https://economictimes.indiatimes.com/markets,markets,29,Tejas Networks sinks 6% after Q4 loss widens by 193% YoY,https://economictimes.indiatimes.com/articleshow/130297324.cms,2026-04-16T07:19:48+00:00
Economic Times,Economic Times • Markets,https://economictimes.indiatimes.com/markets,markets,30,MFs raise tech exposure in March after 8-yr low. Tactical move or trend shift?,https://economictimes.indiatimes.com/articleshow/130298296.cms,2026-04-16T07:19:48+00:00
Economic Times,Economic Times • Markets,https://economictimes.indiatimes.com/markets,markets,31,Suraj Estate soars 15% on land acquisition deal in Mumbai,https://economictimes.indiatimes.com/articleshow/130298232.cms,2026-04-16T07:19:48+00:00
Economic Times,Economic Times • Markets,https://economictimes.indiatimes.com/markets,markets,32,Ola vs Ather: Which one has edge after up to 70% Apr rally?,https://economictimes.indiatimes.com/articleshow/130297398.cms,2026-04-16T07:19:48+00:00
Economic Times,Economic Times • Markets,https://economictimes.indiatimes.com/markets,markets,33,India Inc reduced overseas bond issues on local liquidity,https://economictimes.indiatimes.com/articleshow/130295920.cms,2026-04-16T07:19:48+00:00
Economic Times,Economic Times • Markets,https://economictimes.indiatimes.com/markets,markets,34,HDB Fin zooms 12% on strong Q4 results & FY26 dividend,https://economictimes.indiatimes.com/articleshow/130297107.cms,2026-04-16T07:19:48+00:00
Economic Times,Economic Times • Markets,https://economictimes.indiatimes.com/markets,markets,35,Multi-asset funds offer consistent returns if not big bang,https://economictimes.indiatimes.com/articleshow/130295784.cms,2026-04-16T07:19:48+00:00
Economic Times,Economic Times • Markets,https://economictimes.indiatimes.com/markets,markets,36,Nikkei rises to near record high on Mideast peace hopes,https://economictimes.indiatimes.com/articleshow/130295906.cms,2026-04-16T07:19:48+00:00
Economic Times,Economic Times • Markets,https://economictimes.indiatimes.com/markets,markets,37,Crude oil hovers below $95 amid Iran war peace talks,https://economictimes.indiatimes.com/articleshow/130296467.cms,2026-04-16T07:19:48+00:00
Economic Times,Economic Times • Markets,https://economictimes.indiatimes.com/markets,markets,38,D-St swings hit retail activity; top broker client base falls,https://economictimes.indiatimes.com/articleshow/130295722.cms,2026-04-16T07:19:48+00:00
Economic Times,Economic Times • Markets,https://economictimes.indiatimes.com/markets,markets,39,Sebi allows cos to resize issue size sans new IPO papers,https://economictimes.indiatimes.com/articleshow/130295678.cms,2026-04-16T07:19:48+00:00
Economic Times,Economic Times • Markets,https://economictimes.indiatimes.com/markets,markets,40,Fresh hopes of US-Iran talks bring peace to D-Street,https://economictimes.indiatimes.com/articleshow/130295627.cms,2026-04-16T07:19:48+00:00
Economic Times,Economic Times • Markets,https://economictimes.indiatimes.com/markets,markets,41,"Asian stocks rise, Wall Street hits fresh record on Iran talks",https://economictimes.indiatimes.com/articleshow/130295488.cms,2026-04-16T07:19:48+00:00
Economic Times,Economic Times • Markets,https://economictimes.indiatimes.com/markets,markets,42,"Easing oil prices, among 6 key factors driving market surge",https://economictimes.indiatimes.com/articleshow/130297303.cms,2026-04-16T07:19:48+00:00
Economic Times,Economic Times • Markets,https://economictimes.indiatimes.com/markets,markets,43,"Stocks in news: Wipro, Angel One, HDB Financial and M&M",https://economictimes.indiatimes.com/articleshow/130295515.cms,2026-04-16T07:19:48+00:00
Economic Times,Economic Times • Markets,https://economictimes.indiatimes.com/markets,markets,44,Groww share price dips over 2% after massive 26% gain in 5 sessions. Right time to buy?,https://economictimes.indiatimes.com/articleshow/130299624.cms,2026-04-16T07:19:48+00:00
Economic Times,Economic Times • Markets,https://economictimes.indiatimes.com/markets,markets,45,"Buy the dip in banks, autos & defence",https://economictimes.indiatimes.com/articleshow/130299004.cms,2026-04-16T07:19:48+00:00
Economic Times,Economic Times • Markets,https://economictimes.indiatimes.com/markets,markets,46,India cd be dairy to the world in 10 yrs,https://economictimes.indiatimes.com/articleshow/130280954.cms,2026-04-16T07:19:48+00:00
Economic Times,Economic Times • Markets,https://economictimes.indiatimes.com/markets,markets,47,30-yr IT-based model over; what to buy now,https://economictimes.indiatimes.com/articleshow/130278642.cms,2026-04-16T07:19:48+00:00
Economic Times,Economic Times • Markets,https://economictimes.indiatimes.com/markets,markets,48,"Rally continues, fundamentals weakening",https://economictimes.indiatimes.com/articleshow/130276229.cms,2026-04-16T07:19:48+00:00
Economic Times,Economic Times • Markets,https://economictimes.indiatimes.com/markets,markets,49,Saurabh Mukherjea has moved half his portfolio out of India,https://economictimes.indiatimes.com/articleshow/130279223.cms,2026-04-16T07:19:48+00:00
Economic Times,Economic Times • Markets,https://economictimes.indiatimes.com/markets,markets,50,"Investors pour over Rs 10,000 crore into flexi-cap funds in March",https://economictimes.indiatimes.com/articleshow/130273503.cms,2026-04-16T07:19:48+00:00
Economic Times,Economic Times • Markets,https://economictimes.indiatimes.com/markets,markets,51,"HDFC Bank, TaMo among top stocks MFs bought & sold in March crash",https://economictimes.indiatimes.com/articleshow/130272600.cms,2026-04-16T07:19:48+00:00
Economic Times,Economic Times • Markets,https://economictimes.indiatimes.com/markets,markets,52,"These mid-cap stocks with ‘Strong Buy’ & ‘Buy’ recos can rally over 25%, according to analysts",https://economictimes.indiatimes.com/articleshow/130288245.cms,2026-04-16T07:19:48+00:00
Economic Times,Economic Times • Markets,https://economictimes.indiatimes.com/markets,markets,53,ET Prime Special Series: Multibagger or Bankrupt - Part 54: Will manufacturing capability help this firm move into defence space?,https://economictimes.indiatimes.com/articleshow/130286406.cms,2026-04-16T07:19:48+00:00
Economic Times,Economic Times • Markets,https://economictimes.indiatimes.com/markets,markets,54,"These 10 private and public banking stocks have an upside potential of up to 30% in one year, according to analysts",https://economictimes.indiatimes.com/articleshow/130270608.cms,2026-04-16T07:19:48+00:00
Economic Times,Economic Times • Markets,https://economictimes.indiatimes.com/markets,markets,55,Capital market stocks: Time to change strategy? 10 stocks from different parts of the ecosystem,https://economictimes.indiatimes.com/articleshow/130277994.cms,2026-04-16T07:19:48+00:00
Economic Times,Economic Times • Markets,https://economictimes.indiatimes.com/markets,markets,56,These large-caps have ‘strong buy’ & ‘buy’ recos and an upside potential of up to 25%,https://economictimes.indiatimes.com/articleshow/130243073.cms,2026-04-16T07:19:48+00:00
Economic Times,Economic Times • Markets,https://economictimes.indiatimes.com/markets,markets,57,For investors with ability to think beyond FY27: 5 mid-cap stocks from different sectors with an upside potential up to 33%,https://economictimes.indiatimes.com/articleshow/130253228.cms,2026-04-16T07:19:48+00:00
Economic Times,Economic Times • Markets,https://economictimes.indiatimes.com/markets,markets,58,"Two Trades for Today: A hospital chain for a gain of 3.07%, a mid-cap iron and steel maker’s stock for an almost 6% rise",https://economictimes.indiatimes.com/articleshow/130289720.cms,2026-04-16T07:19:48+00:00
Economic Times,Economic Times • Markets,https://economictimes.indiatimes.com/markets,markets,59,Weekly Top Picks: These stocks scored 10 on 10 on Stock Reports Plus,https://economictimes.indiatimes.com/articleshow/130238844.cms,2026-04-16T07:19:48+00:00
Economic Times,Economic Times • Markets,https://economictimes.indiatimes.com/markets,markets,60,"The right mix: Annuity income, domestic focus and fresh demand. 6 power sector stocks with upside potential of up to 40%",https://economictimes.indiatimes.com/articleshow/130202866.cms,2026-04-16T07:19:48+00:00
Economic Times,Economic Times • Markets,https://economictimes.indiatimes.com/markets,markets,61,Stock picks of the week: 5 stocks with consistent score improvement and upside potential of up to 26%,https://economictimes.indiatimes.com/articleshow/130229481.cms,2026-04-16T07:19:48+00:00
Economic Times,Economic Times • Markets,https://economictimes.indiatimes.com/markets,markets,62,"Two Trades for Today: A private power player for a rise of 7.55%, a mid-cap capital goods stock for an almost 6% upmove",https://economictimes.indiatimes.com/articleshow/130259613.cms,2026-04-16T07:19:48+00:00
Economic Times,Economic Times • Markets,https://economictimes.indiatimes.com/markets,markets,63,Top Nifty50 stocks analysts suggest buying in this volatile week,https://economictimes.indiatimes.com/articleshow/130224485.cms,2026-04-16T07:19:48+00:00
Economic Times,Economic Times • Markets,https://economictimes.indiatimes.com/markets,markets,64,The most dangerous number on an Indian balance sheet after debt – and how it is manipulated,https://economictimes.indiatimes.com/articleshow/130175565.cms,2026-04-16T07:19:48+00:00
Economic Times,Economic Times • Markets,https://economictimes.indiatimes.com/markets,markets,65,Manage short-term risk and volatility for long-term opportunity: 7 stocks from different sectors with upside potential of up to 32%,https://economictimes.indiatimes.com/articleshow/130201334.cms,2026-04-16T07:19:48+00:00
Economic Times,Economic Times • Markets,https://economictimes.indiatimes.com/markets,markets,66,"Two Trades for Today: A top cigarette maker for a gain of 9.5%, a mid-cap capital goods stock for a rise of almost 6.5%",https://economictimes.indiatimes.com/articleshow/130203333.cms,2026-04-16T07:19:48+00:00
Economic Times,Economic Times • Markets,https://economictimes.indiatimes.com/markets,markets,67,"These large- and mid-cap stocks can give more than 25% return in 1 year, according to analysts",https://economictimes.indiatimes.com/articleshow/130150506.cms,2026-04-16T07:19:48+00:00
Economic Times,Economic Times • Markets,https://economictimes.indiatimes.com/markets,markets,68,Investing lessons from Warren Buffett – It is never too late to change: Buffett also changed how he invested,https://economictimes.indiatimes.com/articleshow/130158618.cms,2026-04-16T07:19:48+00:00
Economic Times,Economic Times • Markets,https://economictimes.indiatimes.com/markets,markets,69,Stock picks of the week: 6 stocks with consistent score improvement and upside potential of up to 29%,https://economictimes.indiatimes.com/articleshow/130176592.cms,2026-04-16T07:19:48+00:00
Economic Times,Economic Times • Markets,https://economictimes.indiatimes.com/markets,markets,70,"Time to increase the risk quotient? Maybe, but selectively: 5 large-caps from different sectors with upside potential of up to 28%",https://economictimes.indiatimes.com/articleshow/130135302.cms,2026-04-16T07:19:48+00:00
Economic Times,Economic Times • Markets,https://economictimes.indiatimes.com/markets,markets,71,"These mid-cap stocks with ‘Strong Buy’ & ‘Buy’ recos can rally over 25%, according to analysts",https://economictimes.indiatimes.com/articleshow/130118384.cms,2026-04-16T07:19:48+00:00
Economic Times,Economic Times • Markets,https://economictimes.indiatimes.com/markets,markets,72,"ET Prime Special Series: Multibagger or Bankrupt - Part 53: All vehicles need this auto ancillary’s product, but its EV future is still taking shape",https://economictimes.indiatimes.com/articleshow/130116423.cms,2026-04-16T07:19:48+00:00
Economic Times,Economic Times • Markets,https://economictimes.indiatimes.com/markets,markets,73,HDFC Bank share price,https://economictimes.indiatimes.com/articleshow/129766481.cms,2026-04-16T07:19:48+00:00
Economic Times,Economic Times • Markets,https://economictimes.indiatimes.com/markets,markets,74,SBI Share price,https://economictimes.indiatimes.com/articleshow/129693172.cms,2026-04-16T07:19:48+00:00
Economic Times,Economic Times • Markets,https://economictimes.indiatimes.com/markets,markets,75,HDFC Bank shares crash news,https://economictimes.indiatimes.com/articleshow/129669233.cms,2026-04-16T07:19:48+00:00
Economic Times,Economic Times • Markets,https://economictimes.indiatimes.com/markets,markets,76,NSE Stock Market Holidays in March 2026,https://economictimes.indiatimes.com/articleshow/128937700.cms,2026-04-16T07:19:48+00:00
Economic Times,Economic Times • Markets,https://economictimes.indiatimes.com/markets,markets,77,Angel One share price,https://economictimes.indiatimes.com/articleshow/128802458.cms,2026-04-16T07:19:48+00:00
Economic Times,Economic Times • Markets,https://economictimes.indiatimes.com/markets,markets,78,Waaree Energies share price,https://economictimes.indiatimes.com/articleshow/128774010.cms,2026-04-16T07:19:48+00:00
Economic Times,Economic Times • Markets,https://economictimes.indiatimes.com/markets,markets,79,Vedanta share price,https://economictimes.indiatimes.com/articleshow/128770697.cms,2026-04-16T07:19:48+00:00
Economic Times,Economic Times • Markets,https://economictimes.indiatimes.com/markets,markets,80,RailTel Share Price,https://economictimes.indiatimes.com/articleshow/128140907.cms,2026-04-16T07:19:48+00:00
Economic Times,Economic Times • Markets,https://economictimes.indiatimes.com/markets,markets,81,BSE Share Price,https://economictimes.indiatimes.com/articleshow/128137774.cms,2026-04-16T07:19:48+00:00
Economic Times,Economic Times • Markets,https://economictimes.indiatimes.com/markets,markets,82,InterGlobe Aviation Q3 Results FY26,https://economictimes.indiatimes.com/articleshow/127142781.cms,2026-04-16T07:19:48+00:00
Economic Times,Economic Times • Markets,https://economictimes.indiatimes.com/markets,markets,83,Adani Energy Solutions Q3 Results FY26,https://economictimes.indiatimes.com/articleshow/127139438.cms,2026-04-16T07:19:48+00:00
Economic Times,Economic Times • Markets,https://economictimes.indiatimes.com/markets,markets,84,AUM dipped 6% but inflows stayed strong; Anand Rathi Wealth CEO bets on 29% profit growth in FY27,https://economictimes.indiatimes.com/articleshow/130168626.cms,2026-04-16T07:19:48+00:00
Economic Times,Economic Times • Markets,https://economictimes.indiatimes.com/markets,markets,85,"TCS CEO calls Street ""wrong"" on AI threat; posts $40-bn order book and $2.3 billion in AI revenue for FY26",https://economictimes.indiatimes.com/articleshow/130166020.cms,2026-04-16T07:19:48+00:00
Economic Times,Economic Times • Markets,https://economictimes.indiatimes.com/markets,markets,86,"TCS bets on AI hiring, partnerships as currency gains lift margins; eyes 360-degree ecosystem play",https://economictimes.indiatimes.com/articleshow/130163054.cms,2026-04-16T07:19:48+00:00
Economic Times,Economic Times • Markets,https://economictimes.indiatimes.com/markets,markets,87,"Margins will double, cost of funds to drop 250 bps as IHC deal closes, says Gagan Banga, Sammaan Capital",https://economictimes.indiatimes.com/articleshow/129945939.cms,2026-04-16T07:19:48+00:00
Economic Times,Economic Times • Markets,https://economictimes.indiatimes.com/markets,markets,88,RBI rejects banks’ request to spread out Q4 treasury losses,https://economictimes.indiatimes.com/articleshow/130270856.cms,2026-04-16T07:19:48+00:00
Economic Times,Economic Times • Markets,https://economictimes.indiatimes.com/markets,markets,89,India bonds trim losses as soft CPI spurs value buying,https://economictimes.indiatimes.com/articleshow/130237111.cms,2026-04-16T07:19:48+00:00
Economic Times,Economic Times • Markets,https://economictimes.indiatimes.com/markets,markets,90,India bonds slump after US-Iran peace talks falter,https://economictimes.indiatimes.com/articleshow/130226065.cms,2026-04-16T07:19:48+00:00
Economic Times,Economic Times • Markets,https://economictimes.indiatimes.com/markets,markets,91,"SP Group looks to defer Rs 14,300-cr bond payment",https://economictimes.indiatimes.com/articleshow/130222936.cms,2026-04-16T07:19:48+00:00
Economic Times,Economic Times • Markets,https://economictimes.indiatimes.com/markets,markets,92,"Bitcoin holds near $75,000 as ETF inflows support price amid geopolitical uncertainty",https://economictimes.indiatimes.com/articleshow/130298660.cms,2026-04-16T07:19:48+00:00
Economic Times,Economic Times • Markets,https://economictimes.indiatimes.com/markets,markets,93,"Bitcoin hits $76,000 before easing to $74,500 as whales accumulate, profit booking caps rally",https://economictimes.indiatimes.com/articleshow/130274681.cms,2026-04-16T07:19:48+00:00
Economic Times,Economic Times • Markets,https://economictimes.indiatimes.com/markets,markets,94,"Bitcoin climbs to 4-week high of $74,945",https://economictimes.indiatimes.com/articleshow/130270945.cms,2026-04-16T07:19:48+00:00
Economic Times,Economic Times • Markets,https://economictimes.indiatimes.com/markets,markets,95,"Bitcoin nears $75,000 as crypto market rallies on $1.1 billion inflows; Ethereum holds above $2,300",https://economictimes.indiatimes.com/articleshow/130251519.cms,2026-04-16T07:19:48+00:00
Economic Times,Economic Times • Markets,https://economictimes.indiatimes.com/markets,markets,96,Bitcoin stays firm above $71K after CPI-led rally triggers profit booking,https://economictimes.indiatimes.com/articleshow/130225477.cms,2026-04-16T07:19:48+00:00
Economic Times,Economic Times • Markets,https://economictimes.indiatimes.com/markets,markets,97,"Puravankara Ltd Q4 pre-sales jump 3-fold to Rs 3,547 cr; 55 pc rise in FY26 to Rs 7,407 cr",https://economictimes.indiatimes.com/articleshow/130258047.cms,2026-04-16T07:19:48+00:00
Economic Times,Economic Times • Markets,https://economictimes.indiatimes.com/markets,markets,98,"Sumitomo Corp JV firm Krisumi to invest Rs 4,500 cr on housing project in Gurugram",https://economictimes.indiatimes.com/articleshow/130236383.cms,2026-04-16T07:19:48+00:00
