publisher,source,source_url,category,rank,headline,link,collected_at_iso
Economic Times,Economic Times • Politics,https://economictimes.indiatimes.com/news/politics,politics,57,"if(typeof objAd !=""undefined""){ objAd.loadAds(); } Bullish on Adani group? GQG raises stakes in 3 stocks even as FIIs cut back in market crash",https://economictimes.indiatimes.com/articleshow/130272459.cms,2026-04-16T07:19:48+00:00
Economic Times,Economic Times • Politics,https://economictimes.indiatimes.com/news/politics,politics,58,"Trump says China ‘won’t send weapons to Iran,’ ‘very happy’ with Hormuz opening",https://economictimes.indiatimes.com/articleshow/130283033.cms,2026-04-16T07:19:48+00:00
Economic Times,Economic Times • Politics,https://economictimes.indiatimes.com/news/politics,politics,59,"if(typeof objAd !=""undefined""){ objAd.loadAds(); } Why stock market rose today? Sensex soars over 1,200 points, Nifty settles above 24,200. 5 key factors explained",https://economictimes.indiatimes.com/articleshow/130272488.cms,2026-04-16T07:19:48+00:00
Economic Times,Economic Times • Politics,https://economictimes.indiatimes.com/news/politics,politics,60,Go to Best Actor Oscars 2026 Page,https://economictimes.indiatimes.com/articleshow/129599124.cms,2026-04-16T07:19:48+00:00
Economic Times,Economic Times • Politics,https://economictimes.indiatimes.com/news/politics,politics,61,Go to Happy Holi Wishes Page,https://economictimes.indiatimes.com/articleshow/128976692.cms,2026-04-16T07:19:48+00:00
Economic Times,Economic Times • Politics,https://economictimes.indiatimes.com/news/politics,politics,62,Go to T20 World Cup Points table Page,https://economictimes.indiatimes.com/articleshow/128682246.cms,2026-04-16T07:19:48+00:00
Economic Times,Economic Times • Politics,https://economictimes.indiatimes.com/news/politics,politics,63,Go to Where to watch budget 2026 Speech Live Page,https://economictimes.indiatimes.com/articleshow/127830812.cms,2026-04-16T07:19:48+00:00
Economic Times,Economic Times • Politics,https://economictimes.indiatimes.com/news/politics,politics,64,Go to Oracle stock Crash Page,https://economictimes.indiatimes.com/articleshow/125911867.cms,2026-04-16T07:19:48+00:00
Economic Times,Economic Times • Politics,https://economictimes.indiatimes.com/news/politics,politics,65,Go to 8th Pay Commission News Page,https://economictimes.indiatimes.com/articleshow/125889993.cms,2026-04-16T07:19:48+00:00
Economic Times,Economic Times • Politics,https://economictimes.indiatimes.com/news/politics,politics,66,Go to ICICI bank Page,https://economictimes.indiatimes.com/articleshow/123283709.cms,2026-04-16T07:19:48+00:00
Economic Times,Economic Times • Politics,https://economictimes.indiatimes.com/news/politics,politics,67,"Go to Happy Friendship Day 2025 wishes, quotes images Page",https://economictimes.indiatimes.com/articleshow/123066457.cms,2026-04-16T07:19:48+00:00
Economic Times,Economic Times • Politics,https://economictimes.indiatimes.com/news/politics,politics,68,Go to NYC Shooting Page,https://economictimes.indiatimes.com/articleshow/122975852.cms,2026-04-16T07:19:48+00:00
Economic Times,Economic Times • Politics,https://economictimes.indiatimes.com/news/politics,politics,69,Go to ITR Deadline Page,https://economictimes.indiatimes.com/articleshow/122959557.cms,2026-04-16T07:19:48+00:00
Economic Times,Economic Times • Politics,https://economictimes.indiatimes.com/news/politics,politics,70,Go to IndusInd Bank Q1 Results Page,https://economictimes.indiatimes.com/articleshow/122954115.cms,2026-04-16T07:19:48+00:00
Economic Times,Economic Times • Politics,https://economictimes.indiatimes.com/news/politics,politics,71,Go to hulk hogan death Page,https://economictimes.indiatimes.com/articleshow/122886216.cms,2026-04-16T07:19:48+00:00
Economic Times,Economic Times • Politics,https://economictimes.indiatimes.com/news/politics,politics,72,Go to Vice President Jagdeep Dhankhar resigns Page,https://economictimes.indiatimes.com/articleshow/122819077.cms,2026-04-16T07:19:48+00:00
Economic Times,Economic Times • Politics,https://economictimes.indiatimes.com/news/politics,politics,73,Go to TS EAMCET Counselling Page,https://economictimes.indiatimes.com/articleshow/122764877.cms,2026-04-16T07:19:48+00:00
Economic Times,Economic Times • Politics,https://economictimes.indiatimes.com/news/politics,politics,74,Go to air india flight 171 crash Page,https://economictimes.indiatimes.com/articleshow/122642432.cms,2026-04-16T07:19:48+00:00
Economic Times,Economic Times • Politics,https://economictimes.indiatimes.com/news/politics,politics,75,Go to Is Outlook down Again Page,https://economictimes.indiatimes.com/articleshow/122365727.cms,2026-04-16T07:19:48+00:00
Economic Times,Economic Times • Politics,https://economictimes.indiatimes.com/news/politics,politics,76,"Go to Horoscope Tomorrow, April 17, 2026 Page",https://economictimes.indiatimes.com/articleshow/130299118.cms,2026-04-16T07:19:48+00:00
Economic Times,Economic Times • Politics,https://economictimes.indiatimes.com/news/politics,politics,77,"Go to Horoscope Today, 16th April, 2026 Page",https://economictimes.indiatimes.com/articleshow/130287701.cms,2026-04-16T07:19:48+00:00
Economic Times,Economic Times • Politics,https://economictimes.indiatimes.com/news/politics,politics,78,Go to NC-JCM 8th Pay Commission update Page,https://economictimes.indiatimes.com/articleshow/130259868.cms,2026-04-16T07:19:48+00:00
Economic Times,Economic Times • Politics,https://economictimes.indiatimes.com/news/politics,politics,79,Go to Asha Bhosle passes away at 92 Page,https://economictimes.indiatimes.com/articleshow/130203356.cms,2026-04-16T07:19:48+00:00
Economic Times,Economic Times • Politics,https://economictimes.indiatimes.com/news/politics,politics,80,Go to Telangana TS Inter Results 2026 Page,https://economictimes.indiatimes.com/articleshow/130201602.cms,2026-04-16T07:19:48+00:00
Economic Times,Economic Times • Politics,https://economictimes.indiatimes.com/news/politics,politics,81,Go to TCS Q4 Results FY26 Page,https://economictimes.indiatimes.com/articleshow/130140134.cms,2026-04-16T07:19:48+00:00
Economic Times,Economic Times • Politics,https://economictimes.indiatimes.com/news/politics,politics,82,Go to Ola Electric share price Page,https://economictimes.indiatimes.com/articleshow/130132379.cms,2026-04-16T07:19:48+00:00
Economic Times,Economic Times • Politics,https://economictimes.indiatimes.com/news/politics,politics,83,Go to DA hike delay news Page,https://economictimes.indiatimes.com/articleshow/130119625.cms,2026-04-16T07:19:48+00:00
Economic Times,Economic Times • Politics,https://economictimes.indiatimes.com/news/politics,politics,84,Go to Eli Lilly Foundayo weight loss pill price Page,https://economictimes.indiatimes.com/articleshow/129980299.cms,2026-04-16T07:19:48+00:00
Economic Times,Economic Times • Politics,https://economictimes.indiatimes.com/news/politics,politics,85,Go to SBI Server UPI Down Today Page,https://economictimes.indiatimes.com/articleshow/129945441.cms,2026-04-16T07:19:48+00:00
Economic Times,Economic Times • Politics,https://economictimes.indiatimes.com/news/politics,politics,86,Go to 22k Gold Rate Today Page,https://economictimes.indiatimes.com/articleshow/129896445.cms,2026-04-16T07:19:48+00:00
Economic Times,Economic Times • Politics,https://economictimes.indiatimes.com/news/politics,politics,87,Go to J&K Election Results Highlights Page,https://economictimes.indiatimes.com/articleshow/114028829.cms,2026-04-16T07:19:48+00:00
Economic Times,Economic Times • Politics,https://economictimes.indiatimes.com/news/politics,politics,88,Go to Haryana Election Highlights Page,https://economictimes.indiatimes.com/articleshow/114028584.cms,2026-04-16T07:19:48+00:00
Economic Times,Economic Times • Politics,https://economictimes.indiatimes.com/news/politics,politics,89,Go to Julana Election Results 2024 Page,https://economictimes.indiatimes.com/articleshow/114028425.cms,2026-04-16T07:19:48+00:00
Economic Times,Economic Times • Politics,https://economictimes.indiatimes.com/news/politics,politics,90,Go to Uchana Kalan Election Results Page,https://economictimes.indiatimes.com/articleshow/114028936.cms,2026-04-16T07:19:48+00:00
Economic Times,Economic Times • Politics,https://economictimes.indiatimes.com/news/politics,politics,91,Go to Ambala Cantt Election Result Page,https://economictimes.indiatimes.com/articleshow/114028471.cms,2026-04-16T07:19:48+00:00
Economic Times,Economic Times • Politics,https://economictimes.indiatimes.com/news/politics,politics,92,Go to Kaithal Election Results Page,https://economictimes.indiatimes.com/articleshow/114028571.cms,2026-04-16T07:19:48+00:00
Economic Times,Economic Times • Politics,https://economictimes.indiatimes.com/news/politics,politics,93,Suzlon Energy shares rally 20% in one month: Here's why it is an 'unintended beneficiary' of Iran-US war,https://economictimes.indiatimes.com/articleshow/130299464.cms,2026-04-16T07:19:48+00:00
Economic Times,Economic Times • Politics,https://economictimes.indiatimes.com/news/politics,politics,94,500 GW of renewable energy by 2030: What India must do now,https://economictimes.indiatimes.com/articleshow/130299427.cms,2026-04-16T07:19:48+00:00
Economic Times,Economic Times • Politics,https://economictimes.indiatimes.com/news/politics,politics,95,F&O Radar: Bull Call Spread strategy for Siemens,https://economictimes.indiatimes.com/articleshow/130299543.cms,2026-04-16T07:19:48+00:00
Economic Times,Economic Times • Politics,https://economictimes.indiatimes.com/news/politics,politics,96,"Studied under streetlights, fought mosquitoes: MP slum girl tops class 12 with 98.8%; says 'my father's eyes screamed: succeed or we’ll sink'",https://economictimes.indiatimes.com/articleshow/130299203.cms,2026-04-16T07:19:48+00:00
Economic Times,Economic Times • Politics,https://economictimes.indiatimes.com/news/politics,politics,97,Lowest home loan interest rates in 2026: PSU banks vs private banks; check lists,https://economictimes.indiatimes.com/articleshow/130299574.cms,2026-04-16T07:19:48+00:00
Economic Times,Economic Times • Politics,https://economictimes.indiatimes.com/news/politics,politics,98,Groww share price dips over 2% after massive 26% gain in 5 sessions. Right time to buy?,https://economictimes.indiatimes.com/articleshow/130299624.cms,2026-04-16T07:19:48+00:00
Economic Times,Economic Times • Politics,https://economictimes.indiatimes.com/news/politics,politics,99,Who is Meenu Batra? The 53-year-old Indian-origin interpreter detained by ICE after 35 years in the US,https://economictimes.indiatimes.com/articleshow/130299467.cms,2026-04-16T07:19:48+00:00
Economic Times,Economic Times • Politics,https://economictimes.indiatimes.com/news/politics,politics,100,Bangladesh seeks $2 billion from development partners to meet energy demand,https://economictimes.indiatimes.com/articleshow/130299764.cms,2026-04-16T07:19:48+00:00
Economic Times,Economic Times • Politics,https://economictimes.indiatimes.com/news/politics,politics,101,Zoho layoffs: Sridhar Vembu's firm laid off 300 employees without prior warning? Here's all about the social media buzz,https://economictimes.indiatimes.com/articleshow/130299693.cms,2026-04-16T07:19:48+00:00
Economic Times,Economic Times • Politics,https://economictimes.indiatimes.com/news/politics,politics,102,Why Daniel Moreno-Gama wanted to kill Sam Altman: 20-year-old Texas man’s AI fears and mental health claim explained,https://economictimes.indiatimes.com/articleshow/130299602.cms,2026-04-16T07:19:48+00:00
Economic Times,Economic Times • Politics,https://economictimes.indiatimes.com/news/politics,politics,103,15 actors and directors who graduated from Delhi University's Hindu College: Arjun Rampal to Imtiaz Ali to Tisca Chopra,https://economictimes.indiatimes.com/articleshow/130298436.cms,2026-04-16T07:19:48+00:00
Economic Times,Economic Times • Politics,https://economictimes.indiatimes.com/news/politics,politics,104,"8th Pay Commission salary hike: Why NC-JCM wants minimum basic pay to rise from Rs 18,000 to Rs 69,000",https://economictimes.indiatimes.com/articleshow/130299681.cms,2026-04-16T07:19:48+00:00
Times of India,Times of India • Markets,https://timesofindia.indiatimes.com/business,markets,1,US stock market,https://timesofindia.indiatimes.com/articleshow/130286189.cms,2026-04-16T07:19:48+00:00
Times of India,Times of India • Markets,https://timesofindia.indiatimes.com/business,markets,2,Gold Rate Today,https://timesofindia.indiatimes.com/articleshow/130283214.cms,2026-04-16T07:19:48+00:00
Times of India,Times of India • Markets,https://timesofindia.indiatimes.com/business,markets,3,Stock market today,https://timesofindia.indiatimes.com/articleshow/130287688.cms,2026-04-16T07:19:48+00:00
Times of India,Times of India • Markets,https://timesofindia.indiatimes.com/business,markets,4,FASTag verification drive,https://timesofindia.indiatimes.com/articleshow/130284628.cms,2026-04-16T07:19:48+00:00
Times of India,Times of India • Markets,https://timesofindia.indiatimes.com/business,markets,5,"US won’t renew sanctions waiver on Russian, Iranian oil: What it means for IndiaThe US will not extend waivers allowing the sale of Russian and Iranian oil already at sea, impacting countries like India that secured supplies during the temporary relief. This move signals a return to tighter enforcement of sanctions, forcing nations to restrategize their energy procurement amidst global supply disruptions.",https://timesofindia.indiatimes.com/articleshow/130297227.cms,2026-04-16T07:19:48+00:00
Times of India,Times of India • Markets,https://timesofindia.indiatimes.com/business,markets,6,"Stock market today (April 16, 2026): Nifty50 opens above 24,350; BSE Sensex up over 400 points on oil prices easing, hopes of US-Iran war endingStock market today: Indian equity benchmarks, Sensex and Nifty50, continued their uptrend on Thursday on positive global cues and hopes of an early end to the US-Iran conflict. While Nifty50 went above 24,350, BSE Sensex rose over 400 points.",https://timesofindia.indiatimes.com/articleshow/130296649.cms,2026-04-16T07:19:48+00:00
Times of India,Times of India • Markets,https://timesofindia.indiatimes.com/business,markets,7,New record! Apple’s India vendors export $2.5 billion components to China; may reach $3.5 billion under ECMS,https://timesofindia.indiatimes.com/articleshow/130299840.cms,2026-04-16T07:19:48+00:00
Times of India,Times of India • Markets,https://timesofindia.indiatimes.com/business,markets,8,"Gold, silver price prediction today: Will gold head to Rs 1.65 lakh/10 grams & silver rise to Rs 2.80 lakh/kg?",https://timesofindia.indiatimes.com/articleshow/130298548.cms,2026-04-16T07:19:48+00:00
Times of India,Times of India • Markets,https://timesofindia.indiatimes.com/business,markets,9,"Asian stocks today: Markets inch higher on US-Iran peace hopes; Nikkei jumps 2%, HSI adds 360 points",https://timesofindia.indiatimes.com/articleshow/130297747.cms,2026-04-16T07:19:48+00:00
Times of India,Times of India • Markets,https://timesofindia.indiatimes.com/business,markets,10,"Top stocks to buy today: Stock recommendations for April 16, 2026 - check listTop stock market recommendations: Aditya Vision Ltd, Allied Blenders and Distillers Ltd, and NMDC - these are the stocks that Aakash K Hindocha, Deputy Vice President - WM Research of Nuvama Professional Clients Group has shortlisted as top buy calls for today (April 16, 2026). His views on Nifty and Bank Nifty are also available:",https://timesofindia.indiatimes.com/articleshow/130296445.cms,2026-04-16T07:19:48+00:00
Times of India,Times of India • Markets,https://timesofindia.indiatimes.com/business,markets,11,Fertiliser imports turn costly: IPL gets urea bids almost double previous rates,https://timesofindia.indiatimes.com/articleshow/130296719.cms,2026-04-16T07:19:48+00:00
Times of India,Times of India • Markets,https://timesofindia.indiatimes.com/business,markets,12,"Pine Labs, Groww & more: Top stocks to watch on April 16",https://timesofindia.indiatimes.com/articleshow/130296305.cms,2026-04-16T07:19:48+00:00
Times of India,Times of India • Markets,https://timesofindia.indiatimes.com/business,markets,13,"Tata Trusts board 'illegal', replace it: Mehli Mistry",https://timesofindia.indiatimes.com/articleshow/130296089.cms,2026-04-16T07:19:48+00:00
Times of India,Times of India • Markets,https://timesofindia.indiatimes.com/business,markets,14,US will not extend temporary sanctions waiver on sale of Russian and Iranian oil,https://timesofindia.indiatimes.com/articleshow/130295521.cms,2026-04-16T07:19:48+00:00
Times of India,Times of India • Markets,https://timesofindia.indiatimes.com/business,markets,15,SIA chief set to meet Tata Sons and AI chairman N Chandrasekaran today,https://timesofindia.indiatimes.com/articleshow/130295296.cms,2026-04-16T07:19:48+00:00
Times of India,Times of India • Markets,https://timesofindia.indiatimes.com/business,markets,16,"At $442 billion, India's goods exports hit record high in 2025-26",https://timesofindia.indiatimes.com/articleshow/130295286.cms,2026-04-16T07:19:48+00:00
Times of India,Times of India • Markets,https://timesofindia.indiatimes.com/business,markets,17,"'Concerns should be addressed bilaterally': No need for unilateral 301 probe, India to US",https://timesofindia.indiatimes.com/articleshow/130295229.cms,2026-04-16T07:19:48+00:00
Times of India,Times of India • Markets,https://timesofindia.indiatimes.com/business,markets,18,"D-Street banks on West Asia peace talks, Sensex rises 1.3k points",https://timesofindia.indiatimes.com/articleshow/130295220.cms,2026-04-16T07:19:48+00:00
Times of India,Times of India • Markets,https://timesofindia.indiatimes.com/business,markets,19,"India rejects US Section 301 allegations, seeks termination; calls for resolution via talks",https://timesofindia.indiatimes.com/articleshow/130291279.cms,2026-04-16T07:19:48+00:00
Times of India,Times of India • Markets,https://timesofindia.indiatimes.com/business,markets,20,Onion exports up 40 per cent in March,https://timesofindia.indiatimes.com/articleshow/130291000.cms,2026-04-16T07:19:48+00:00
Times of India,Times of India • Markets,https://timesofindia.indiatimes.com/business,markets,21,Oil price today: Crude dips to $90 amid hopes of Middle East de escalation,https://timesofindia.indiatimes.com/articleshow/130296028.cms,2026-04-16T07:19:48+00:00
Times of India,Times of India • Markets,https://timesofindia.indiatimes.com/business,markets,22,"Veteran investor Mark Mobius dies at 89, leaves behind global investing legacy",https://timesofindia.indiatimes.com/articleshow/130291016.cms,2026-04-16T07:19:48+00:00
Times of India,Times of India • Markets,https://timesofindia.indiatimes.com/business,markets,23,"Donald Trump targets Fed chief Jerome Powell again, threatens to fire him if he is 'not leaving on time'",https://timesofindia.indiatimes.com/articleshow/130285837.cms,2026-04-16T07:19:48+00:00
Times of India,Times of India • Markets,https://timesofindia.indiatimes.com/business,markets,24,Pakistan plans 2-hour daily power cuts as Iran war drives up energy costs,https://timesofindia.indiatimes.com/articleshow/130282889.cms,2026-04-16T07:19:48+00:00
Times of India,Times of India • Markets,https://timesofindia.indiatimes.com/business,markets,25,Iran war impact: Will Pakistan be forced into rationing fuel if conflict drags on?,https://timesofindia.indiatimes.com/articleshow/130277261.cms,2026-04-16T07:19:48+00:00
Times of India,Times of India • Markets,https://timesofindia.indiatimes.com/business,markets,26,Pakistan gets $3 billion from Saudi Arabia as 'support' to shore up forex reserves as UAE debt looms,https://timesofindia.indiatimes.com/articleshow/130273318.cms,2026-04-16T07:19:48+00:00
Times of India,Times of India • Markets,https://timesofindia.indiatimes.com/business,markets,27,"Asian stocks today: Markets rally as hopes of US-Iran talks lift sentiment, oil prices ease",https://timesofindia.indiatimes.com/articleshow/130272482.cms,2026-04-16T07:19:48+00:00
Times of India,Times of India • Markets,https://timesofindia.indiatimes.com/business,markets,28,Higher Trump tariffs soon? US Treasury Secretary Bessent says rates could be restored by July,https://timesofindia.indiatimes.com/articleshow/130272294.cms,2026-04-16T07:19:48+00:00
Times of India,Times of India • Markets,https://timesofindia.indiatimes.com/business,markets,29,"Oil prices today: Crude steadies after slump as US, Iran eye fresh peace talks",https://timesofindia.indiatimes.com/articleshow/130272032.cms,2026-04-16T07:19:48+00:00
Times of India,Times of India • Markets,https://timesofindia.indiatimes.com/business,markets,30,"US Treasury chief backs IMF, World Bank shift; says institutions on ‘right track’ after criticism",https://timesofindia.indiatimes.com/articleshow/130265783.cms,2026-04-16T07:19:48+00:00
Times of India,Times of India • Markets,https://timesofindia.indiatimes.com/business,markets,31,"Crude oil prices today: Brent, WTI fall up to 6% on hopes of US-Iran talks; supply risks persist",https://timesofindia.indiatimes.com/articleshow/130264889.cms,2026-04-16T07:19:48+00:00
Times of India,Times of India • Markets,https://timesofindia.indiatimes.com/business,markets,32,"US markets today (April 14, 2026): Dow, S&P 500, Nasdaq rise on Middle East de-escalation hopes; earnings in focus",https://timesofindia.indiatimes.com/articleshow/130262631.cms,2026-04-16T07:19:48+00:00
Times of India,Times of India • Markets,https://timesofindia.indiatimes.com/business,markets,33,"US wholesale inflation data: Producer prices rise 4% as Iran war fuels energy surge, Fed faces policy dilemma",https://timesofindia.indiatimes.com/articleshow/130261667.cms,2026-04-16T07:19:48+00:00
Times of India,Times of India • Markets,https://timesofindia.indiatimes.com/business,markets,34,Russia's crude oil export revenues jump to $19 billion in March as Iran war lifts prices,https://timesofindia.indiatimes.com/articleshow/130257121.cms,2026-04-16T07:19:48+00:00
Times of India,Times of India • Markets,https://timesofindia.indiatimes.com/business,markets,35,1.14 lakh startups generate more than 12 lakh jobs in India: Finance ministry,https://timesofindia.indiatimes.com/articleshow/107262154.cms,2026-04-16T07:19:48+00:00
Times of India,Times of India • Markets,https://timesofindia.indiatimes.com/business,markets,36,These startups are helping carbon dioxide find a new life,https://timesofindia.indiatimes.com/articleshow/106920179.cms,2026-04-16T07:19:48+00:00
Times of India,Times of India • Markets,https://timesofindia.indiatimes.com/business,markets,37,E-commerce firm Udaan raises $340 million ahead of planned IPO,https://timesofindia.indiatimes.com/articleshow/105991030.cms,2026-04-16T07:19:48+00:00
Times of India,Times of India • Markets,https://timesofindia.indiatimes.com/business,markets,38,Minuscule AI startup raises $41 million to tap India growth,https://timesofindia.indiatimes.com/articleshow/105804471.cms,2026-04-16T07:19:48+00:00
Times of India,Times of India • Markets,https://timesofindia.indiatimes.com/business,markets,39,ZestMoney set to shut operations this month,https://timesofindia.indiatimes.com/articleshow/105764280.cms,2026-04-16T07:19:48+00:00
Times of India,Times of India • Markets,https://timesofindia.indiatimes.com/business,markets,40,Startups will play important role in helping India become 3rd largest economy: CEA Nageswaran,https://timesofindia.indiatimes.com/articleshow/105332523.cms,2026-04-16T07:19:48+00:00
Times of India,Times of India • Markets,https://timesofindia.indiatimes.com/business,markets,41,E-Commerce startup Udaan to trim costs ahead of 2025 IPO,https://timesofindia.indiatimes.com/articleshow/105001132.cms,2026-04-16T07:19:48+00:00
Times of India,Times of India • Markets,https://timesofindia.indiatimes.com/business,markets,42,Kerala-based startup bags prestigious awards,https://timesofindia.indiatimes.com/articleshow/104623571.cms,2026-04-16T07:19:48+00:00
Times of India,Times of India • Markets,https://timesofindia.indiatimes.com/business,markets,43,Startup BharatAgri raises Rs 35 crore from investors,https://timesofindia.indiatimes.com/articleshow/104557903.cms,2026-04-16T07:19:48+00:00
Times of India,Times of India • Markets,https://timesofindia.indiatimes.com/business,markets,44,Co-living startup Settl to enter Chennai market,https://timesofindia.indiatimes.com/articleshow/104557612.cms,2026-04-16T07:19:48+00:00
Times of India,Times of India • Markets,https://timesofindia.indiatimes.com/business,markets,45,Agnikul raises Rs 200 crore in Series B funding,https://timesofindia.indiatimes.com/articleshow/104483927.cms,2026-04-16T07:19:48+00:00
Times of India,Times of India • Markets,https://timesofindia.indiatimes.com/business,markets,46,Space sector start-up Sisir Radar to develop SAR on L/P band SAR,https://timesofindia.indiatimes.com/articleshow/104558111.cms,2026-04-16T07:19:48+00:00
Times of India,Times of India • Markets,https://timesofindia.indiatimes.com/business,markets,47,Sachidanand Upadhyay : A Visionary Leader Dedicated To Building A Better Tomorrow,https://timesofindia.indiatimes.com/articleshow/115720905.cms,2026-04-16T07:19:48+00:00
Times of India,Times of India • Markets,https://timesofindia.indiatimes.com/business,markets,48,Honouring Innovations and Leaders in Climate Action for a Sustainable Future,https://timesofindia.indiatimes.com/articleshow/115481857.cms,2026-04-16T07:19:48+00:00
