publisher,source,source_url,category,rank,headline,link,collected_at_iso
Times of India,Times of India • Sports,https://timesofindia.indiatimes.com/sports,sports,92,Montreal Canadiens goaltender Jakub Dobes issues apology to Andrei Vasilevskiy after NHL Game 1 overtime moment,https://timesofindia.indiatimes.com/articleshow/130392176.cms,2026-04-21T01:28:48+00:00
Times of India,Times of India • Sports,https://timesofindia.indiatimes.com/sports,sports,93,Connor McDavid admits ‘monotonous’ regular season as Oilers shift focus to high-stakes playoff game,https://timesofindia.indiatimes.com/articleshow/130380459.cms,2026-04-21T01:28:48+00:00
Times of India,Times of India • Sports,https://timesofindia.indiatimes.com/sports,sports,94,Connor McDavid’s wife Lauren Kyle celebrates emotional milestone as Oilers captain gears up for electrifying Stanley Cup playoff run,https://timesofindia.indiatimes.com/articleshow/130364134.cms,2026-04-21T01:28:48+00:00
Times of India,Times of India • Sports,https://timesofindia.indiatimes.com/sports,sports,95,"Exploring Connor Bedard's financial status in 2026: A look at his career earnings, current salary, brand deals, and more",https://timesofindia.indiatimes.com/articleshow/130361807.cms,2026-04-21T01:28:48+00:00
Times of India,Times of India • Sports,https://timesofindia.indiatimes.com/sports,sports,96,"NHL Playoffs 2026: Full match schedule, start timings, list of qualified teams, where to watch, and more",https://timesofindia.indiatimes.com/articleshow/130360792.cms,2026-04-21T01:28:48+00:00
Times of India,Times of India • Sports,https://timesofindia.indiatimes.com/sports,sports,97,Toronto Maple Leafs defenseman Morgan Reilly addresses trade speculation after disappointing NHL season,https://timesofindia.indiatimes.com/articleshow/130359746.cms,2026-04-21T01:28:48+00:00
Times of India,Times of India • Sports,https://timesofindia.indiatimes.com/sports,sports,98,Connor Bedard reaffirms commitment to Chicago Blackhawks future while management targets roster upgrades for NHL 2026 campaign,https://timesofindia.indiatimes.com/articleshow/130355556.cms,2026-04-21T01:28:48+00:00
Times of India,Times of India • Sports,https://timesofindia.indiatimes.com/sports,sports,99,Vancouver Canucks rookie Zeev Buium discusses his NHL debut season growth while Kevin Bieksa highlights elite future potential,https://timesofindia.indiatimes.com/articleshow/130355468.cms,2026-04-21T01:28:48+00:00
Times of India,Times of India • Sports,https://timesofindia.indiatimes.com/sports,sports,100,NHL trade rumors intensify as Patrick Kane discusses potential return to Detroit Red Wings next season,https://timesofindia.indiatimes.com/articleshow/130355413.cms,2026-04-21T01:28:48+00:00
Times of India,Times of India • Sports,https://timesofindia.indiatimes.com/sports,sports,101,Toronto Maple Leafs forward Matthew Knies emerges as Chicago Blackhawks target in latest NHL trade rumors,https://timesofindia.indiatimes.com/articleshow/130354781.cms,2026-04-21T01:28:48+00:00
Times of India,Times of India • Sports,https://timesofindia.indiatimes.com/sports,sports,102,Jim Rutherford sparks NHL trade rumors over Quinn Hughes' Vancouver Canucks exit raising Minnesota Wild absence concerns,https://timesofindia.indiatimes.com/articleshow/130354695.cms,2026-04-21T01:28:48+00:00
Times of India,Times of India • Sports,https://timesofindia.indiatimes.com/sports,sports,103,"Fortnite Explosive Power Hour (April 18, 2026): Start timings for all regions",https://timesofindia.indiatimes.com/articleshow/130350877.cms,2026-04-21T01:28:48+00:00
Times of India,Times of India • Sports,https://timesofindia.indiatimes.com/sports,sports,104,"Is Fortnite down (April 16, 2026)? v40.20 update server downtime details",https://timesofindia.indiatimes.com/articleshow/130298498.cms,2026-04-21T01:28:48+00:00
Times of India,Times of India • Sports,https://timesofindia.indiatimes.com/sports,sports,105,Fortnite v40.20 update release time for all regions,https://timesofindia.indiatimes.com/articleshow/130298078.cms,2026-04-21T01:28:48+00:00
Times of India,Times of India • Sports,https://timesofindia.indiatimes.com/sports,sports,106,How to download Minecraft Bedrock 26.20.27 beta and preview,https://timesofindia.indiatimes.com/articleshow/130284982.cms,2026-04-21T01:28:48+00:00
Times of India,Times of India • Sports,https://timesofindia.indiatimes.com/sports,sports,107,EA FC 26 Serie A TOTS players leaked: Ratings and more,https://timesofindia.indiatimes.com/articleshow/130284349.cms,2026-04-21T01:28:48+00:00
Times of India,Times of India • Sports,https://timesofindia.indiatimes.com/sports,sports,108,All active Fortnite Garden vs Brainrots codes (April 2026),https://timesofindia.indiatimes.com/articleshow/130260952.cms,2026-04-21T01:28:48+00:00
Times of India,Times of India • Sports,https://timesofindia.indiatimes.com/sports,sports,109,Everything new in Fortnite v40.20 update,https://timesofindia.indiatimes.com/articleshow/130257417.cms,2026-04-21T01:28:48+00:00
Times of India,Times of India • Sports,https://timesofindia.indiatimes.com/sports,sports,110,"Esports Nations Cup announces 16-game lineup; 100,000 players from 100 nations to compete",https://timesofindia.indiatimes.com/articleshow/130251867.cms,2026-04-21T01:28:48+00:00
Times of India,Times of India • Sports,https://timesofindia.indiatimes.com/sports,sports,111,How to build automatic Kelp Farm in Minecraft Bedrock,https://timesofindia.indiatimes.com/articleshow/130230217.cms,2026-04-21T01:28:48+00:00
Times of India,Times of India • Sports,https://timesofindia.indiatimes.com/sports,sports,112,"Fortnite Laufey skin release date, price, and more details",https://timesofindia.indiatimes.com/articleshow/130225788.cms,2026-04-21T01:28:48+00:00
Times of India,Times of India • Sports,https://timesofindia.indiatimes.com/sports,sports,113,"Top 20 Clash Royale decks in 2026 ranked: Full card lists, meta insights, and strategy guide (April)",https://timesofindia.indiatimes.com/articleshow/130194324.cms,2026-04-21T01:28:48+00:00
Times of India,Times of India • Sports,https://timesofindia.indiatimes.com/sports,sports,114,"Fortnite Reload Elite Stronghold update release date, new map, weapons, and more",https://timesofindia.indiatimes.com/articleshow/130204825.cms,2026-04-21T01:28:48+00:00
Times of India,Times of India • Sports,https://timesofindia.indiatimes.com/sports,sports,115,EA FC 26 Premier League Team of the Season (TOTS) predictions,https://timesofindia.indiatimes.com/articleshow/130204413.cms,2026-04-21T01:28:48+00:00
Times of India,Times of India • Sports,https://timesofindia.indiatimes.com/sports,sports,116,"Fortnite High Flyin' Power Hour (April 11, 2026): Start timings for all regions",https://timesofindia.indiatimes.com/articleshow/130187257.cms,2026-04-21T01:28:48+00:00
Times of India,Times of India • Sports,https://timesofindia.indiatimes.com/sports,sports,117,How to get Toy Story skins in Fortnite: Buzz Lightyear and Zurg,https://timesofindia.indiatimes.com/articleshow/130186876.cms,2026-04-21T01:28:48+00:00
Times of India,Times of India • Sports,https://timesofindia.indiatimes.com/sports,sports,118,"Minecraft Chaos Cubed update: Release date, features and more",https://timesofindia.indiatimes.com/articleshow/130175456.cms,2026-04-21T01:28:48+00:00
Times of India,Times of India • Sports,https://timesofindia.indiatimes.com/sports,sports,119,CM Punk makes hilarious gesture after losing heavyweight title to Roman Reigns at WrestleMania 42,https://timesofindia.indiatimes.com/articleshow/130382543.cms,2026-04-21T01:28:48+00:00
Times of India,Times of India • Sports,https://timesofindia.indiatimes.com/sports,sports,120,Brock Lesnar vs. Oba Femi Net Worth comparison: Which WWE superstar leads the charge after WrestleMania 42 match?,https://timesofindia.indiatimes.com/articleshow/130381786.cms,2026-04-21T01:28:48+00:00
Times of India,Times of India • Sports,https://timesofindia.indiatimes.com/sports,sports,121,Was Oba Femi the right choice to beat Brock Lesnar in his final match after he teased WWE retirement at WrestleMania 42?,https://timesofindia.indiatimes.com/articleshow/130381344.cms,2026-04-21T01:28:48+00:00
Times of India,Times of India • Sports,https://timesofindia.indiatimes.com/sports,sports,122,“We’re gonna fix that”: Roman Reigns set to resolve major scheduling issue as he calls out Oba Femi,https://timesofindia.indiatimes.com/articleshow/130381419.cms,2026-04-21T01:28:48+00:00
Times of India,Times of India • Sports,https://timesofindia.indiatimes.com/sports,sports,123,"WWE WrestleMania 42: List of winners, top performers, shocking moments, and more",https://timesofindia.indiatimes.com/articleshow/130380652.cms,2026-04-21T01:28:48+00:00
Times of India,Times of India • Sports,https://timesofindia.indiatimes.com/sports,sports,124,Shocking report reveals original WrestleMania 42 plans for Randy Orton,https://timesofindia.indiatimes.com/articleshow/130380779.cms,2026-04-21T01:28:48+00:00
Times of India,Times of India • Sports,https://timesofindia.indiatimes.com/sports,sports,125,"WWE WrestleMania 42 Night 2 Results & Highlights: Roman Reigns wins World title after 2 years, Brock Lesnar signals retirement, and more",https://timesofindia.indiatimes.com/articleshow/130380420.cms,2026-04-21T01:28:48+00:00
Times of India,Times of India • Sports,https://timesofindia.indiatimes.com/sports,sports,126,Did Brock Lesnar retire? Here’s what his WrestleMania 42 gesture means,https://timesofindia.indiatimes.com/articleshow/130380348.cms,2026-04-21T01:28:48+00:00
Times of India,Times of India • Sports,https://timesofindia.indiatimes.com/sports,sports,127,"WWE WrestleMania 42 Night 2: US, UK, India, Brazil, Saudi Arabia, Japan start timings, how to watch live, date, venue, full match card, and more",https://timesofindia.indiatimes.com/articleshow/130370202.cms,2026-04-21T01:28:48+00:00
Times of India,Times of India • Sports,https://timesofindia.indiatimes.com/sports,sports,128,Cody Rhodes injury update: Latest on American Nightmare following win over Randy Orton at WrestleMania 42,https://timesofindia.indiatimes.com/articleshow/130364630.cms,2026-04-21T01:28:48+00:00
Times of India,Times of India • Sports,https://timesofindia.indiatimes.com/sports,sports,129,Who is Bianca Belair’s husband Montez Ford? All about 3x Women’s World Champ’s personal life as she announced pregnancy at WrestleMania 42,https://timesofindia.indiatimes.com/articleshow/130364430.cms,2026-04-21T01:28:48+00:00
Times of India,Times of India • Sports,https://timesofindia.indiatimes.com/sports,sports,130,What happened to Cora Jade? Ex-WWE star alleges fan misconduct at WrestleCon in a viral video,https://timesofindia.indiatimes.com/articleshow/130364287.cms,2026-04-21T01:28:48+00:00
Times of India,Times of India • Sports,https://timesofindia.indiatimes.com/sports,sports,131,"WWE WrestleMania 42 Night 1 Results & Highlights: Randy Orton punt kicks Cody Rhodes, new champions, shocking returns, and more",https://timesofindia.indiatimes.com/articleshow/130364215.cms,2026-04-21T01:28:48+00:00
Times of India,Times of India • Sports,https://timesofindia.indiatimes.com/sports,sports,132,AJ Lee vs Becky Lynch result: How The Man defeated her daughter’s favorite wrestler to win IC Championship,https://timesofindia.indiatimes.com/articleshow/130364168.cms,2026-04-21T01:28:48+00:00
Times of India,Times of India • Sports,https://timesofindia.indiatimes.com/sports,sports,133,Fan favorite WWE superstar makes surprise return after nine years to team up with Brie Bella,https://timesofindia.indiatimes.com/articleshow/130364042.cms,2026-04-21T01:28:48+00:00
Times of India,Times of India • Sports,https://timesofindia.indiatimes.com/sports,sports,134,WWE WrestleMania 42: John Cena and Nikki Bella reunion on the cards in a possible last-minute twist,https://timesofindia.indiatimes.com/articleshow/130361613.cms,2026-04-21T01:28:48+00:00
Times of India,Times of India • Sports,https://timesofindia.indiatimes.com/sports,sports,135,Who is Austin Hedges’ Girlfriend? All about Lexi Dickinson and their romantic baseball love story,https://timesofindia.indiatimes.com/articleshow/130400172.cms,2026-04-21T01:28:48+00:00
Times of India,Times of India • Sports,https://timesofindia.indiatimes.com/sports,sports,136,"Garret Anderson family: Meet former Los Angeles star’s wife Teresa Anderson and children Brianne, Bailey, and Trey",https://timesofindia.indiatimes.com/articleshow/130343009.cms,2026-04-21T01:28:48+00:00
Times of India,Times of India • Sports,https://timesofindia.indiatimes.com/sports,sports,137,Mlb reporter Angie Mentink gives perfect response after viral video shows her using AI for Seattle Mariners question,https://timesofindia.indiatimes.com/articleshow/130341000.cms,2026-04-21T01:28:48+00:00
Times of India,Times of India • Sports,https://timesofindia.indiatimes.com/sports,sports,138,Former Angels star Garret Anderson dies at 53 after sudden medical emergency at home,https://timesofindia.indiatimes.com/articleshow/130338585.cms,2026-04-21T01:28:48+00:00
Times of India,Times of India • Sports,https://timesofindia.indiatimes.com/sports,sports,139,MLB umpire Brock Ballou assaulted in Philadelphia as second violent attack within minutes raises concern,https://timesofindia.indiatimes.com/articleshow/130313375.cms,2026-04-21T01:28:48+00:00
Times of India,Times of India • Sports,https://timesofindia.indiatimes.com/sports,sports,140,"Phil Garner net worth, inside Astros manager career and earnings after death at 76",https://timesofindia.indiatimes.com/articleshow/130220413.cms,2026-04-21T01:28:48+00:00
Times of India,Times of India • Sports,https://timesofindia.indiatimes.com/sports,sports,141,Los Angeles Dodgers legend Davey Lopes passes away at 80 after Parkinson’s disease fight,https://timesofindia.indiatimes.com/articleshow/130123181.cms,2026-04-21T01:28:48+00:00
Times of India,Times of India • Sports,https://timesofindia.indiatimes.com/sports,sports,142,Ozzie Guillen left in tears during live MLB broadcast as Chicago White Sox deliver emotional surprise,https://timesofindia.indiatimes.com/articleshow/130026888.cms,2026-04-21T01:28:48+00:00
Times of India,Times of India • Sports,https://timesofindia.indiatimes.com/sports,sports,143,Konnor Griffin’s $140 million MLB debut turns emotional as wife and mom react wildly to RBI double,https://timesofindia.indiatimes.com/articleshow/130026374.cms,2026-04-21T01:28:48+00:00
Times of India,Times of India • Sports,https://timesofindia.indiatimes.com/sports,sports,144,"Jonathan Lucroy calls out Travis Kelce and Jason Kelce after bold baseball workout comments, highlights true MLB endurance struggle",https://timesofindia.indiatimes.com/articleshow/129989702.cms,2026-04-21T01:28:48+00:00
Times of India,Times of India • Sports,https://timesofindia.indiatimes.com/sports,sports,145,Why did fans fight at Dodger Stadium on opening day? Viral video shows Los Angeles Dodgers vs Arizona Diamondbacks game spiraling into chaos,https://timesofindia.indiatimes.com/articleshow/129869628.cms,2026-04-21T01:28:48+00:00
Times of India,Times of India • Sports,https://timesofindia.indiatimes.com/sports,sports,146,Alex Vesia’s wife Kayla Vesia reveals pain of losing daughter Sterling during emotional Dodgers Opening Day moment,https://timesofindia.indiatimes.com/articleshow/129852255.cms,2026-04-21T01:28:48+00:00
Times of India,Times of India • Sports,https://timesofindia.indiatimes.com/sports,sports,147,"Jason Heyward net worth in 2026: Inside his MLB career, earnings, Cubs title impact and retirement decision",https://timesofindia.indiatimes.com/articleshow/129851703.cms,2026-04-21T01:28:48+00:00
Times of India,Times of India • Sports,https://timesofindia.indiatimes.com/sports,sports,148,Paul Skenes nightmare in New York as Livvy Dunne’s boyfriend pulled early after Pittsburgh Pirates Opening Day collapse,https://timesofindia.indiatimes.com/articleshow/129834078.cms,2026-04-21T01:28:48+00:00
Times of India,Times of India • Sports,https://timesofindia.indiatimes.com/sports,sports,149,MLB Opening Day 2026 turns chaotic as Max Fried dominates but fans slam Netflix Yankees vs Giants broadcast,https://timesofindia.indiatimes.com/articleshow/129833814.cms,2026-04-21T01:28:48+00:00
Times of India,Times of India • Sports,https://timesofindia.indiatimes.com/sports,sports,150,Zack Short traded for cash to Washington Nationals adds fuel as New York Yankees fans react to Hal Steinbrenner payroll stance,https://timesofindia.indiatimes.com/articleshow/129813800.cms,2026-04-21T01:28:48+00:00
Times of India,Times of India • Sports,https://timesofindia.indiatimes.com/sports,sports,151,Formula E veteran Sebastien Buemi wins 6 Hours of Imola; Nyck de Vries also on podium,https://timesofindia.indiatimes.com/articleshow/130401115.cms,2026-04-21T01:28:48+00:00
Times of India,Times of India • Sports,https://timesofindia.indiatimes.com/sports,sports,152,Porsche unveils Formula E GEN4 car 975 RSE as Pascal Wehrlein and Nico Muller are impressed by its efficiency,https://timesofindia.indiatimes.com/articleshow/130399704.cms,2026-04-21T01:28:48+00:00
Times of India,Times of India • Sports,https://timesofindia.indiatimes.com/sports,sports,153,Formula E: Electric Evolution arrives to boost Formula Legends for PC and simcade racers,https://timesofindia.indiatimes.com/articleshow/130355583.cms,2026-04-21T01:28:48+00:00
Times of India,Times of India • Sports,https://timesofindia.indiatimes.com/sports,sports,154,"After Formula E wins, Antonio Felix da Costa set for WEC comeback at 6 Hours of Imola",https://timesofindia.indiatimes.com/articleshow/130340765.cms,2026-04-21T01:28:48+00:00
Times of India,Times of India • Sports,https://timesofindia.indiatimes.com/sports,sports,155,New Coding The Chaos episode explains magic of regenerative braking in Formula E,https://timesofindia.indiatimes.com/articleshow/130339415.cms,2026-04-21T01:28:48+00:00
Times of India,Times of India • Sports,https://timesofindia.indiatimes.com/sports,sports,156,Jaguar unveils sleek GEN4 proto_TYPE and even Lucas Di Grassi is left in awe,https://timesofindia.indiatimes.com/articleshow/130316036.cms,2026-04-21T01:28:48+00:00
Times of India,Times of India • Sports,https://timesofindia.indiatimes.com/sports,sports,157,"Oliver Rowland returns to Dubai as normalcy resumes, shares glimpse of house construction",https://timesofindia.indiatimes.com/articleshow/130314887.cms,2026-04-21T01:28:48+00:00
Times of India,Times of India • Sports,https://timesofindia.indiatimes.com/sports,sports,158,"Pascal Wehrlein impresses on the slopes in the Swiss Alps with skiing and snowboarding, watch",https://timesofindia.indiatimes.com/articleshow/130285061.cms,2026-04-21T01:28:48+00:00
Times of India,Times of India • Sports,https://timesofindia.indiatimes.com/sports,sports,159,"Formula E appoints Will Brown as Chief Commercial Officer; Jeff Dodds says, “He will play a critical role in shaping our next phase”",https://timesofindia.indiatimes.com/articleshow/130284833.cms,2026-04-21T01:28:48+00:00
Times of India,Times of India • Sports,https://timesofindia.indiatimes.com/sports,sports,160,Taylor Barnard remains positive ahead of Berlin E-Prix after tough races: “We’re working hard to come back stronger”,https://timesofindia.indiatimes.com/articleshow/130173511.cms,2026-04-21T01:28:48+00:00
Times of India,Times of India • Sports,https://timesofindia.indiatimes.com/sports,sports,161,Lucas di Grassi on new F1 rules: “There’s no real consistency in technological development”,https://timesofindia.indiatimes.com/articleshow/130172692.cms,2026-04-21T01:28:48+00:00
Times of India,Times of India • Sports,https://timesofindia.indiatimes.com/sports,sports,162,"Two double-headers, one rare record: Antonio Felix da Costa’s unmatched Formula E feat",https://timesofindia.indiatimes.com/articleshow/130149742.cms,2026-04-21T01:28:48+00:00
Times of India,Times of India • Sports,https://timesofindia.indiatimes.com/sports,sports,163,Cupra Kiro’s Pepe Marti reveals preference for night and dry races in rapid-fire round,https://timesofindia.indiatimes.com/articleshow/130147809.cms,2026-04-21T01:28:48+00:00
Times of India,Times of India • Sports,https://timesofindia.indiatimes.com/sports,sports,164,“You have to study”: Pepe Marti highlights importance of a Formula E driver’s manual,https://timesofindia.indiatimes.com/articleshow/130119638.cms,2026-04-21T01:28:48+00:00
Times of India,Times of India • Sports,https://timesofindia.indiatimes.com/sports,sports,165,New Formula E team Opel signs German driver Sophia Florsch as Test and Development Driver,https://timesofindia.indiatimes.com/articleshow/130118452.cms,2026-04-21T01:28:48+00:00
Times of India,Times of India • Sports,https://timesofindia.indiatimes.com/sports,sports,166,"“Oh dear God, who gave you a mic?”: Alexa Rendell reveals Jake Dennis’ reaction to her as a presenter",https://timesofindia.indiatimes.com/articleshow/130092532.cms,2026-04-21T01:28:48+00:00
Times of India,Times of India • Sports,https://timesofindia.indiatimes.com/sports,sports,167,Is marriage soon on cards for Lewis Hamilton and Kim Kardashian? Love birds spotted hanging out with Kardashian’s kids ahead of Japanese Grand Prix 2026,https://timesofindia.indiatimes.com/articleshow/129776382.cms,2026-04-21T01:28:48+00:00
Times of India,Times of India • Sports,https://timesofindia.indiatimes.com/sports,sports,168,"Kimi Antonelli’s net worth set to jump after Chinese Grand Prix win, Mercedes star celebrates with new car",https://timesofindia.indiatimes.com/articleshow/129705626.cms,2026-04-21T01:28:48+00:00
Times of India,Times of India • Sports,https://timesofindia.indiatimes.com/sports,sports,169,"Lando Norris to get his first Madame Tussauds wax figure in London this summer, joins Lewis Hamilton in this unique feat",https://timesofindia.indiatimes.com/articleshow/129679011.cms,2026-04-21T01:28:48+00:00
Times of India,Times of India • Sports,https://timesofindia.indiatimes.com/sports,sports,170,“So it’s official?”: Fans react as Lewis Hamilton comments on Kim Kardashian’s post,https://timesofindia.indiatimes.com/articleshow/129640348.cms,2026-04-21T01:28:48+00:00
Times of India,Times of India • Sports,https://timesofindia.indiatimes.com/sports,sports,171,Charles Leclerc and Alexandra Saint Mleux’s combined net worth: How wealthy are the newlyweds?,https://timesofindia.indiatimes.com/articleshow/129615871.cms,2026-04-21T01:28:48+00:00
Times of India,Times of India • Sports,https://timesofindia.indiatimes.com/sports,sports,172,Lewis Hamilton celebrates Oscar win as ‘F1’ Film takes home Best Sound at Academy Awards,https://timesofindia.indiatimes.com/articleshow/129612615.cms,2026-04-21T01:28:48+00:00
Times of India,Times of India • Sports,https://timesofindia.indiatimes.com/sports,sports,173,"Kimi Antonelli breaks down after winning Chinese Grand Prix, Lewis Hamilton joins him on podium: “I'm so happy for you”",https://timesofindia.indiatimes.com/articleshow/129587598.cms,2026-04-21T01:28:48+00:00
Times of India,Times of India • Sports,https://timesofindia.indiatimes.com/sports,sports,174,"Bahrain Grand Prix and Saudi Arabian Grand Prix cancelled, F1 boss Stefano Domenicali says “We cannot wait to be back”",https://timesofindia.indiatimes.com/articleshow/129586164.cms,2026-04-21T01:28:48+00:00
Times of India,Times of India • Sports,https://timesofindia.indiatimes.com/sports,sports,175,F1 WAGs Carmen Montero Mundt and Alexandra Leclerc hang out together in Shanghai as George Russell wins Sprint,https://timesofindia.indiatimes.com/articleshow/129578205.cms,2026-04-21T01:28:48+00:00
Times of India,Times of India • Sports,https://timesofindia.indiatimes.com/sports,sports,176,Lewis Hamilton and Kim Kardashian’s combined net worth is in billions: Inside their wealth and income,https://timesofindia.indiatimes.com/articleshow/129560461.cms,2026-04-21T01:28:48+00:00
Times of India,Times of India • Sports,https://timesofindia.indiatimes.com/sports,sports,177,"Carmen Montero Mundt dons George Russell’s jacket at Sprint Qualifying, Alexandra Leclerc also turns heads in Shanghai",https://timesofindia.indiatimes.com/articleshow/129555747.cms,2026-04-21T01:28:48+00:00
Times of India,Times of India • Sports,https://timesofindia.indiatimes.com/sports,sports,178,"Chinese Grand Prix 2026 schedule: Preview, race time, where to watch, streaming details and what to expect",https://timesofindia.indiatimes.com/articleshow/129493979.cms,2026-04-21T01:28:48+00:00
Times of India,Times of India • Sports,https://timesofindia.indiatimes.com/sports,sports,179,"Fernando Alonso’s net worth prediction in 2026: From a 300-car museum to a Dubai mansion, the Aston Martin star has it all",https://timesofindia.indiatimes.com/articleshow/129475085.cms,2026-04-21T01:28:48+00:00
Times of India,Times of India • Sports,https://timesofindia.indiatimes.com/sports,sports,180,George Russell’s net worth prediction in 2026: Here’s how an F1 title could transform his fortune this season,https://timesofindia.indiatimes.com/articleshow/129410036.cms,2026-04-21T01:28:48+00:00
Times of India,Times of India • Sports,https://timesofindia.indiatimes.com/sports,sports,181,"George Russell’s girlfriend Carmen Montero Mundt joins him in Shanghai after missing Australian GP, couple goes on food adventure",https://timesofindia.indiatimes.com/articleshow/129402639.cms,2026-04-21T01:28:48+00:00
