publisher,source,source_url,category,rank,headline,link,collected_at_iso
Economic Times,Economic Times • Politics,https://economictimes.indiatimes.com/news/politics,politics,17,"SIR in West Bengal: Will call for report from chief justice of HC today itself, says SC",https://economictimes.indiatimes.com/articleshow/130388462.cms,2026-04-21T01:28:48+00:00
Economic Times,Economic Times • Politics,https://economictimes.indiatimes.com/news/politics,politics,18,West Bengal Assembly Elections: TMC bastion under threat as BJP veteran Swapan Dasgupta takes on Debasish Kumar in Rashbehari,https://economictimes.indiatimes.com/articleshow/130388097.cms,2026-04-21T01:28:48+00:00
Economic Times,Economic Times • Politics,https://economictimes.indiatimes.com/news/politics,politics,19,ECI imposes 48-hour dry days in Tamil Nadu and West Bengal ahead of polling,https://economictimes.indiatimes.com/articleshow/130387971.cms,2026-04-21T01:28:48+00:00
Economic Times,Economic Times • Politics,https://economictimes.indiatimes.com/news/politics,politics,20,Nitish Kumar to monitor Bihar development despite stepping down as CM,https://economictimes.indiatimes.com/articleshow/130387631.cms,2026-04-21T01:28:48+00:00
Economic Times,Economic Times • Politics,https://economictimes.indiatimes.com/news/politics,politics,21,"""They set fire to it"": Rahul Gandhi slams BJP after fresh tensions in Manipur",https://economictimes.indiatimes.com/articleshow/130387333.cms,2026-04-21T01:28:48+00:00
Economic Times,Economic Times • Politics,https://economictimes.indiatimes.com/news/politics,politics,22,Nitin Nabin accuses TMC of betraying women over quota bill,https://economictimes.indiatimes.com/articleshow/130387208.cms,2026-04-21T01:28:48+00:00
Economic Times,Economic Times • Politics,https://economictimes.indiatimes.com/news/politics,politics,23,"West Bengal polls: ECI cracks down on musclemen, 135 arrested ahead of Phase 1 voting",https://economictimes.indiatimes.com/articleshow/130387125.cms,2026-04-21T01:28:48+00:00
Economic Times,Economic Times • Politics,https://economictimes.indiatimes.com/news/politics,politics,24,"India, South Korea to upgrade trade pact, deepen tech and supply chain ties",https://economictimes.indiatimes.com/articleshow/130386996.cms,2026-04-21T01:28:48+00:00
Economic Times,Economic Times • Politics,https://economictimes.indiatimes.com/news/politics,politics,25,Inside Assam’s big contest: Sarma’s dominance vs Gogoi’s comeback bet,https://economictimes.indiatimes.com/articleshow/130386792.cms,2026-04-21T01:28:48+00:00
Economic Times,Economic Times • Politics,https://economictimes.indiatimes.com/news/politics,politics,26,"West Bengal assembly elections 2026: Jobs, migration, welfare schemes dominate poll narrative in Purulia",https://economictimes.indiatimes.com/articleshow/130401102.cms,2026-04-21T01:28:48+00:00
Economic Times,Economic Times • Politics,https://economictimes.indiatimes.com/news/politics,politics,27,BJP eyes repeat win as TMC tries to reclaim lost ground in Kharagpur Sadar constituency,https://economictimes.indiatimes.com/articleshow/130400921.cms,2026-04-21T01:28:48+00:00
Economic Times,Economic Times • Politics,https://economictimes.indiatimes.com/news/politics,politics,28,PM Narendra Modi's 'jhalmuri' stop a 'drama': Mamata Banerjee,https://economictimes.indiatimes.com/articleshow/130400786.cms,2026-04-21T01:28:48+00:00
Economic Times,Economic Times • Politics,https://economictimes.indiatimes.com/news/politics,politics,29,Our vote and MK Stalin's vote bank intact; TVK not a factor: Senthil Balaji,https://economictimes.indiatimes.com/articleshow/130400348.cms,2026-04-21T01:28:48+00:00
Economic Times,Economic Times • Politics,https://economictimes.indiatimes.com/news/politics,politics,30,AIADMK has surrendered to BJP: Rahul Gandhi in Tamil Nadu,https://economictimes.indiatimes.com/articleshow/130400208.cms,2026-04-21T01:28:48+00:00
Economic Times,Economic Times • Politics,https://economictimes.indiatimes.com/news/politics,politics,31,Women's Reservation Bill: Karnataka CM accuses PM Modi of adopting 'double standard',https://economictimes.indiatimes.com/articleshow/130386611.cms,2026-04-21T01:28:48+00:00
Economic Times,Economic Times • Politics,https://economictimes.indiatimes.com/news/politics,politics,32,ED searches premises linked to Karnataka Congress MLA’s sons in crypto probe,https://economictimes.indiatimes.com/articleshow/130383704.cms,2026-04-21T01:28:48+00:00
Economic Times,Economic Times • Politics,https://economictimes.indiatimes.com/news/politics,politics,33,'Monumental setback' for PM Modi's foreign policy: Congress on Pakistan's role in US-Iran peace moves,https://economictimes.indiatimes.com/articleshow/130382419.cms,2026-04-21T01:28:48+00:00
Economic Times,Economic Times • Politics,https://economictimes.indiatimes.com/news/politics,politics,34,"Let truth flow, let philosophers bloom: Bihar's prohibition law in focus under leadership of Samrat Choudhary",https://economictimes.indiatimes.com/articleshow/130381877.cms,2026-04-21T01:28:48+00:00
Economic Times,Economic Times • Politics,https://economictimes.indiatimes.com/news/politics,politics,35,"National Herald case: Delhi HC to hear ED plea against Sonia, Rahul Gandhi today",https://economictimes.indiatimes.com/articleshow/130381909.cms,2026-04-21T01:28:48+00:00
Economic Times,Economic Times • Politics,https://economictimes.indiatimes.com/news/politics,politics,36,Kashmir parties urge authorities to release Baramulla MP Rashid,https://economictimes.indiatimes.com/articleshow/130376865.cms,2026-04-21T01:28:48+00:00
Economic Times,Economic Times • Politics,https://economictimes.indiatimes.com/news/politics,politics,37,Goa: Congress demands arrest of right-wing speaker over 'objectionable' remarks against St Francis Xavier,https://economictimes.indiatimes.com/articleshow/130375532.cms,2026-04-21T01:28:48+00:00
Economic Times,Economic Times • Politics,https://economictimes.indiatimes.com/news/politics,politics,38,Karnataka CM Siddaramaiah on backfoot over Muslim anger; loyalist ousters ahead of bypoll results,https://economictimes.indiatimes.com/articleshow/130374694.cms,2026-04-21T01:28:48+00:00
Economic Times,Economic Times • Politics,https://economictimes.indiatimes.com/news/politics,politics,39,Guwahati court denies non-bailable arrest warrant against Congress leader Pawan Khera,https://economictimes.indiatimes.com/articleshow/130372420.cms,2026-04-21T01:28:48+00:00
Economic Times,Economic Times • Politics,https://economictimes.indiatimes.com/news/politics,politics,40,Jawaharlal Nehru obstructed Somnath temple reconstruction but Vallabhbhai Patel's firm resolve prevailed: Yogi Adityanath,https://economictimes.indiatimes.com/articleshow/130371965.cms,2026-04-21T01:28:48+00:00
Economic Times,Economic Times • Politics,https://economictimes.indiatimes.com/news/politics,politics,41,'Factually Abused Quackery': Congress' dig at government FAQs on women's quota bill,https://economictimes.indiatimes.com/articleshow/130371536.cms,2026-04-21T01:28:48+00:00
Economic Times,Economic Times • Politics,https://economictimes.indiatimes.com/news/politics,politics,42,"Kanyakumari turns into rare national battleground as Congress, BJP, TVK lock horns",https://economictimes.indiatimes.com/articleshow/130371224.cms,2026-04-21T01:28:48+00:00
Economic Times,Economic Times • Politics,https://economictimes.indiatimes.com/news/politics,politics,43,Rationalisation of voters in Lok Sabha constituencies: A look at seats with highest and lowest no. of voters,https://economictimes.indiatimes.com/articleshow/130370424.cms,2026-04-21T01:28:48+00:00
Economic Times,Economic Times • Politics,https://economictimes.indiatimes.com/news/politics,politics,44,Women's quota row: UP CM Yogi Adityanath likens opposition conduct in Lok Sabha to Draupadi 'cheerharan',https://economictimes.indiatimes.com/articleshow/130370318.cms,2026-04-21T01:28:48+00:00
Economic Times,Economic Times • Politics,https://economictimes.indiatimes.com/news/politics,politics,45,"Cong demands implementation of women's quota law on current LS strength, marches to BJP office",https://economictimes.indiatimes.com/articleshow/130368607.cms,2026-04-21T01:28:48+00:00
Economic Times,Economic Times • Politics,https://economictimes.indiatimes.com/news/politics,politics,46,Opposition plans to move fresh notice seeking removal of CEC Gyanesh Kumar,https://economictimes.indiatimes.com/articleshow/130364783.cms,2026-04-21T01:28:48+00:00
Economic Times,Economic Times • Politics,https://economictimes.indiatimes.com/news/politics,politics,47,Votes for NDA will derail Tamil Nadu's progress: CM Stalin,https://economictimes.indiatimes.com/articleshow/130364759.cms,2026-04-21T01:28:48+00:00
Economic Times,Economic Times • Politics,https://economictimes.indiatimes.com/news/politics,politics,48,Narendra Modi to address four rallies in West Bengal on Sunday,https://economictimes.indiatimes.com/articleshow/130364715.cms,2026-04-21T01:28:48+00:00
Economic Times,Economic Times • Politics,https://economictimes.indiatimes.com/news/politics,politics,49,West Bengal: Election Commission adds around 7 lakh new voters ahead of polls,https://economictimes.indiatimes.com/articleshow/130364682.cms,2026-04-21T01:28:48+00:00
Economic Times,Economic Times • Politics,https://economictimes.indiatimes.com/news/politics,politics,50,Donald Trump U.S election,https://economictimes.indiatimes.com/articleshow/114984671.cms,2026-04-21T01:28:48+00:00
Economic Times,Economic Times • Politics,https://economictimes.indiatimes.com/news/politics,politics,51,"if(typeof objAd !=""undefined""){ objAd.loadAds(); } Quote of the day by Plato: 'There are two things a person should never be angry at, what they can help, and what they cannot' - Student of Socrates explains the philosophy of anger management to achieve peace of mind",https://economictimes.indiatimes.com/articleshow/130375792.cms,2026-04-21T01:28:48+00:00
Economic Times,Economic Times • Politics,https://economictimes.indiatimes.com/news/politics,politics,52,"U.S. Stock Market prediction for Monday: S&P 500, Dow Jones, Nasdaq set for volatile trading, to be driven by these factors",https://economictimes.indiatimes.com/articleshow/130381614.cms,2026-04-21T01:28:48+00:00
Economic Times,Economic Times • Politics,https://economictimes.indiatimes.com/news/politics,politics,53,"if(typeof objAd !=""undefined""){ objAd.loadAds(); } UAE asks US for a wartime financial lifeline as Iran conflict drags: Report",https://economictimes.indiatimes.com/articleshow/130381408.cms,2026-04-21T01:28:48+00:00
Economic Times,Economic Times • Politics,https://economictimes.indiatimes.com/news/politics,politics,54,India seeks to cool war’s oil burn with flex-fuel shift,https://economictimes.indiatimes.com/articleshow/130383970.cms,2026-04-21T01:28:48+00:00
Economic Times,Economic Times • Politics,https://economictimes.indiatimes.com/news/politics,politics,55,"if(typeof objAd !=""undefined""){ objAd.loadAds(); } Protest erupts in Nepal against taxation on imports above 100 rupees from India",https://economictimes.indiatimes.com/articleshow/130375272.cms,2026-04-21T01:28:48+00:00
Economic Times,Economic Times • Politics,https://economictimes.indiatimes.com/news/politics,politics,56,"if(typeof objAd !=""undefined""){ objAd.loadAds(); } 'You can start any day': 98-year-old Ahmedabad woman is Anand Mahindra's inspiration. Who is Prabhavati Nani?",https://economictimes.indiatimes.com/articleshow/130381916.cms,2026-04-21T01:28:48+00:00
Economic Times,Economic Times • Politics,https://economictimes.indiatimes.com/news/politics,politics,57,"if(typeof objAd !=""undefined""){ objAd.loadAds(); } Vedanta announces demerger record date, shareholders to get 1:1 shares in new entities",https://economictimes.indiatimes.com/articleshow/130392744.cms,2026-04-21T01:28:48+00:00
Economic Times,Economic Times • Politics,https://economictimes.indiatimes.com/news/politics,politics,58,"if(typeof objAd !=""undefined""){ objAd.loadAds(); } US seizes Iranian cargo ship, Tehran vows to retaliate",https://economictimes.indiatimes.com/articleshow/130380184.cms,2026-04-21T01:28:48+00:00
Economic Times,Economic Times • Politics,https://economictimes.indiatimes.com/news/politics,politics,59,"The delimitation debate reflects our inability to eschew the politics of handouts, caste and ethnicity",https://economictimes.indiatimes.com/articleshow/130375799.cms,2026-04-21T01:28:48+00:00
Economic Times,Economic Times • Politics,https://economictimes.indiatimes.com/news/politics,politics,60,QR code in red envelope leads to “invite-only” Instagram page: What we know so far,https://economictimes.indiatimes.com/articleshow/121338235.cms,2026-04-21T01:28:48+00:00
Economic Times,Economic Times • Politics,https://economictimes.indiatimes.com/news/politics,politics,61,"if(typeof objAd !=""undefined""){ objAd.loadAds(); } FIIs bought 120 Indian stocks in Q4 amid Rs 1.3 lakh crore exodus. What's special about them?",https://economictimes.indiatimes.com/articleshow/130381981.cms,2026-04-21T01:28:48+00:00
Economic Times,Economic Times • Politics,https://economictimes.indiatimes.com/news/politics,politics,62,"if(typeof objAd !=""undefined""){ objAd.loadAds(); } Extend GSTR-3B return filing deadline: Demand by advocates and CAs as the portal is not working properly",https://economictimes.indiatimes.com/articleshow/130389795.cms,2026-04-21T01:28:48+00:00
Economic Times,Economic Times • Politics,https://economictimes.indiatimes.com/news/politics,politics,63,"if(typeof objAd !=""undefined""){ objAd.loadAds(); } India’s truckers brace for first diesel price hike in four years",https://economictimes.indiatimes.com/articleshow/130387614.cms,2026-04-21T01:28:48+00:00
Economic Times,Economic Times • Politics,https://economictimes.indiatimes.com/news/politics,politics,64,Go to Best Actor Oscars 2026 Page,https://economictimes.indiatimes.com/articleshow/129599124.cms,2026-04-21T01:28:48+00:00
Economic Times,Economic Times • Politics,https://economictimes.indiatimes.com/news/politics,politics,65,Go to Happy Holi Wishes Page,https://economictimes.indiatimes.com/articleshow/128976692.cms,2026-04-21T01:28:48+00:00
Economic Times,Economic Times • Politics,https://economictimes.indiatimes.com/news/politics,politics,66,Go to T20 World Cup Points table Page,https://economictimes.indiatimes.com/articleshow/128682246.cms,2026-04-21T01:28:48+00:00
Economic Times,Economic Times • Politics,https://economictimes.indiatimes.com/news/politics,politics,67,Go to Where to watch budget 2026 Speech Live Page,https://economictimes.indiatimes.com/articleshow/127830812.cms,2026-04-21T01:28:48+00:00
Economic Times,Economic Times • Politics,https://economictimes.indiatimes.com/news/politics,politics,68,Go to Oracle stock Crash Page,https://economictimes.indiatimes.com/articleshow/125911867.cms,2026-04-21T01:28:48+00:00
Economic Times,Economic Times • Politics,https://economictimes.indiatimes.com/news/politics,politics,69,Go to 8th Pay Commission News Page,https://economictimes.indiatimes.com/articleshow/125889993.cms,2026-04-21T01:28:48+00:00
Economic Times,Economic Times • Politics,https://economictimes.indiatimes.com/news/politics,politics,70,Go to ICICI bank Page,https://economictimes.indiatimes.com/articleshow/123283709.cms,2026-04-21T01:28:48+00:00
Economic Times,Economic Times • Politics,https://economictimes.indiatimes.com/news/politics,politics,71,"Go to Happy Friendship Day 2025 wishes, quotes images Page",https://economictimes.indiatimes.com/articleshow/123066457.cms,2026-04-21T01:28:48+00:00
Economic Times,Economic Times • Politics,https://economictimes.indiatimes.com/news/politics,politics,72,Go to NYC Shooting Page,https://economictimes.indiatimes.com/articleshow/122975852.cms,2026-04-21T01:28:48+00:00
Economic Times,Economic Times • Politics,https://economictimes.indiatimes.com/news/politics,politics,73,Go to ITR Deadline Page,https://economictimes.indiatimes.com/articleshow/122959557.cms,2026-04-21T01:28:48+00:00
Economic Times,Economic Times • Politics,https://economictimes.indiatimes.com/news/politics,politics,74,Go to IndusInd Bank Q1 Results Page,https://economictimes.indiatimes.com/articleshow/122954115.cms,2026-04-21T01:28:48+00:00
Economic Times,Economic Times • Politics,https://economictimes.indiatimes.com/news/politics,politics,75,Go to hulk hogan death Page,https://economictimes.indiatimes.com/articleshow/122886216.cms,2026-04-21T01:28:48+00:00
Economic Times,Economic Times • Politics,https://economictimes.indiatimes.com/news/politics,politics,76,Go to Vice President Jagdeep Dhankhar resigns Page,https://economictimes.indiatimes.com/articleshow/122819077.cms,2026-04-21T01:28:48+00:00
Economic Times,Economic Times • Politics,https://economictimes.indiatimes.com/news/politics,politics,77,Go to TS EAMCET Counselling Page,https://economictimes.indiatimes.com/articleshow/122764877.cms,2026-04-21T01:28:48+00:00
Economic Times,Economic Times • Politics,https://economictimes.indiatimes.com/news/politics,politics,78,Go to air india flight 171 crash Page,https://economictimes.indiatimes.com/articleshow/122642432.cms,2026-04-21T01:28:48+00:00
Economic Times,Economic Times • Politics,https://economictimes.indiatimes.com/news/politics,politics,79,Go to Is Outlook down Again Page,https://economictimes.indiatimes.com/articleshow/122365727.cms,2026-04-21T01:28:48+00:00
Economic Times,Economic Times • Politics,https://economictimes.indiatimes.com/news/politics,politics,80,"Go to Horoscope Today, 21st April 2026 Page",https://economictimes.indiatimes.com/articleshow/130396994.cms,2026-04-21T01:28:48+00:00
Economic Times,Economic Times • Politics,https://economictimes.indiatimes.com/news/politics,politics,81,"Go to Horoscope Tomorrow, April 21, 2026 Page",https://economictimes.indiatimes.com/articleshow/130383633.cms,2026-04-21T01:28:48+00:00
Economic Times,Economic Times • Politics,https://economictimes.indiatimes.com/news/politics,politics,82,Go to NC-JCM 8th Pay Commission update Page,https://economictimes.indiatimes.com/articleshow/130259868.cms,2026-04-21T01:28:48+00:00
Economic Times,Economic Times • Politics,https://economictimes.indiatimes.com/news/politics,politics,83,Go to Why is stock market up today? Page,https://economictimes.indiatimes.com/articleshow/130272488.cms,2026-04-21T01:28:48+00:00
Economic Times,Economic Times • Politics,https://economictimes.indiatimes.com/news/politics,politics,84,Go to Asha Bhosle passes away at 92 Page,https://economictimes.indiatimes.com/articleshow/130203356.cms,2026-04-21T01:28:48+00:00
Economic Times,Economic Times • Politics,https://economictimes.indiatimes.com/news/politics,politics,85,Go to Telangana TS Inter Results 2026 Page,https://economictimes.indiatimes.com/articleshow/130201602.cms,2026-04-21T01:28:48+00:00
Economic Times,Economic Times • Politics,https://economictimes.indiatimes.com/news/politics,politics,86,Go to TCS Q4 Results FY26 Page,https://economictimes.indiatimes.com/articleshow/130140134.cms,2026-04-21T01:28:48+00:00
Economic Times,Economic Times • Politics,https://economictimes.indiatimes.com/news/politics,politics,87,Go to Ola Electric share price Page,https://economictimes.indiatimes.com/articleshow/130132379.cms,2026-04-21T01:28:48+00:00
Economic Times,Economic Times • Politics,https://economictimes.indiatimes.com/news/politics,politics,88,Go to DA hike delay news Page,https://economictimes.indiatimes.com/articleshow/130119625.cms,2026-04-21T01:28:48+00:00
Economic Times,Economic Times • Politics,https://economictimes.indiatimes.com/news/politics,politics,89,Go to Eli Lilly Foundayo weight loss pill price Page,https://economictimes.indiatimes.com/articleshow/129980299.cms,2026-04-21T01:28:48+00:00
Economic Times,Economic Times • Politics,https://economictimes.indiatimes.com/news/politics,politics,90,Go to SBI Server UPI Down Today Page,https://economictimes.indiatimes.com/articleshow/129945441.cms,2026-04-21T01:28:48+00:00
Economic Times,Economic Times • Politics,https://economictimes.indiatimes.com/news/politics,politics,91,Go to 22k Gold Rate Today Page,https://economictimes.indiatimes.com/articleshow/129896445.cms,2026-04-21T01:28:48+00:00
Economic Times,Economic Times • Politics,https://economictimes.indiatimes.com/news/politics,politics,92,Go to J&K Election Results Highlights Page,https://economictimes.indiatimes.com/articleshow/114028829.cms,2026-04-21T01:28:48+00:00
Economic Times,Economic Times • Politics,https://economictimes.indiatimes.com/news/politics,politics,93,Go to Haryana Election Highlights Page,https://economictimes.indiatimes.com/articleshow/114028584.cms,2026-04-21T01:28:48+00:00
Economic Times,Economic Times • Politics,https://economictimes.indiatimes.com/news/politics,politics,94,Go to Julana Election Results 2024 Page,https://economictimes.indiatimes.com/articleshow/114028425.cms,2026-04-21T01:28:48+00:00
Economic Times,Economic Times • Politics,https://economictimes.indiatimes.com/news/politics,politics,95,Go to Uchana Kalan Election Results Page,https://economictimes.indiatimes.com/articleshow/114028936.cms,2026-04-21T01:28:48+00:00
Economic Times,Economic Times • Politics,https://economictimes.indiatimes.com/news/politics,politics,96,Go to Ambala Cantt Election Result Page,https://economictimes.indiatimes.com/articleshow/114028471.cms,2026-04-21T01:28:48+00:00
Economic Times,Economic Times • Politics,https://economictimes.indiatimes.com/news/politics,politics,97,Go to Kaithal Election Results Page,https://economictimes.indiatimes.com/articleshow/114028571.cms,2026-04-21T01:28:48+00:00
Economic Times,Economic Times • Politics,https://economictimes.indiatimes.com/news/politics,politics,98,"Global Market Today: Asian stocks gain, oil dips on hopes of Iran talks",https://economictimes.indiatimes.com/articleshow/130405064.cms,2026-04-21T01:28:48+00:00
Economic Times,Economic Times • Politics,https://economictimes.indiatimes.com/news/politics,politics,99,"What’s your age? Check your Social Security pay in 2026 — age-wise benefits, average check & maximum payout explained",https://economictimes.indiatimes.com/articleshow/130405026.cms,2026-04-21T01:28:48+00:00
Economic Times,Economic Times • Politics,https://economictimes.indiatimes.com/news/politics,politics,100,"IPL 2026 SRH VS DC Live Streaming: How to watch Hyderabad vs Delhi clash live in US, Canada and UK - Preview, Start Time, Venue, Squads and More",https://economictimes.indiatimes.com/articleshow/130405091.cms,2026-04-21T01:28:48+00:00
Economic Times,Economic Times • Politics,https://economictimes.indiatimes.com/news/politics,politics,101,Trump offers mixed messages about path ahead for US war against Iran,https://economictimes.indiatimes.com/articleshow/130405056.cms,2026-04-21T01:28:48+00:00
Economic Times,Economic Times • Politics,https://economictimes.indiatimes.com/news/politics,politics,102,Apple's Tim Cook to step down as CEO in September,https://economictimes.indiatimes.com/articleshow/130405077.cms,2026-04-21T01:28:48+00:00
Economic Times,Economic Times • Politics,https://economictimes.indiatimes.com/news/politics,politics,103,Amazon to invest up to $25 billion in Anthropic as part of $100 billion cloud deal,https://economictimes.indiatimes.com/articleshow/130405094.cms,2026-04-21T01:28:48+00:00
Economic Times,Economic Times • Politics,https://economictimes.indiatimes.com/news/politics,politics,104,Vance to travel to Pakistan on Tuesday for Iran talks,https://economictimes.indiatimes.com/articleshow/130405120.cms,2026-04-21T01:28:48+00:00
Economic Times,Economic Times • Politics,https://economictimes.indiatimes.com/news/politics,politics,105,"India, US continue to have 'positive, productive discussions' on trade deal",https://economictimes.indiatimes.com/articleshow/130405096.cms,2026-04-21T01:28:48+00:00
Economic Times,Economic Times • Politics,https://economictimes.indiatimes.com/news/politics,politics,106,Trump claims US 'winning' against Iran ahead of crucial talks in Islamabad,https://economictimes.indiatimes.com/articleshow/130405014.cms,2026-04-21T01:28:48+00:00
Economic Times,Economic Times • Politics,https://economictimes.indiatimes.com/news/politics,politics,107,"Stocks in news: HCL Tech, Vedanta, Jio Financial, IndusInd Bank, Suzlon Energy",https://economictimes.indiatimes.com/articleshow/130405003.cms,2026-04-21T01:28:48+00:00
Economic Times,Economic Times • Politics,https://economictimes.indiatimes.com/news/politics,politics,108,Bitcoin strongest since February amid mid-east hopes,https://economictimes.indiatimes.com/articleshow/130404975.cms,2026-04-21T01:28:48+00:00
Economic Times,Economic Times • Politics,https://economictimes.indiatimes.com/news/politics,politics,109,Commodity traders now cozy up to Trump,https://economictimes.indiatimes.com/articleshow/130404992.cms,2026-04-21T01:28:48+00:00
Economic Times,Economic Times • Politics,https://economictimes.indiatimes.com/news/politics,politics,110,Pre-market action: Here's the trade setup for today's session,https://economictimes.indiatimes.com/articleshow/130405038.cms,2026-04-21T01:28:48+00:00
Economic Times,Economic Times • Politics,https://economictimes.indiatimes.com/news/politics,politics,111,"Oil falls on expectations US-Iran talks likely to proceed, opening supply",https://economictimes.indiatimes.com/articleshow/130405157.cms,2026-04-21T01:28:48+00:00
Economic Times,Economic Times • Politics,https://economictimes.indiatimes.com/news/politics,politics,112,Countries backing navigation in Strait of Hormuz sending 'right message': IMO chief,https://economictimes.indiatimes.com/articleshow/130405129.cms,2026-04-21T01:28:48+00:00
