publisher,source,source_url,category,rank,headline,link,collected_at_iso
Times of India,Times of India • Sports,https://timesofindia.indiatimes.com/sports,sports,60,Vanessa Bryant gives personal update with her daughters in a heartwarming post,https://timesofindia.indiatimes.com/articleshow/130237548.cms,2026-04-16T07:19:48+00:00
Times of India,Times of India • Sports,https://timesofindia.indiatimes.com/sports,sports,61,‘I almost quit’: Janice Tjen opens up on journey to WTA success | TOI Exclusive,https://timesofindia.indiatimes.com/articleshow/130252398.cms,2026-04-16T07:19:48+00:00
Times of India,Times of India • Sports,https://timesofindia.indiatimes.com/sports,sports,62,"BJK Cup: India win the battle, lose the war and fail to make playoffs",https://timesofindia.indiatimes.com/articleshow/130196817.cms,2026-04-16T07:19:48+00:00
Times of India,Times of India • Sports,https://timesofindia.indiatimes.com/sports,sports,63,"BJK cup: Mongolia done, Korea challenge looms",https://timesofindia.indiatimes.com/articleshow/130183846.cms,2026-04-16T07:19:48+00:00
Times of India,Times of India • Sports,https://timesofindia.indiatimes.com/sports,sports,64,Billie Jean King Cup: India trounce Mongolia with one eye on South Korea,https://timesofindia.indiatimes.com/articleshow/130173306.cms,2026-04-16T07:19:48+00:00
Times of India,Times of India • Sports,https://timesofindia.indiatimes.com/sports,sports,65,BJK Cup: Vaishnavi Adkar impresses but Indonesia prevail over India,https://timesofindia.indiatimes.com/articleshow/130159615.cms,2026-04-16T07:19:48+00:00
Times of India,Times of India • Sports,https://timesofindia.indiatimes.com/sports,sports,66,From hope to heartbreak: India learn the cost of not closing things out in BJK Cup,https://timesofindia.indiatimes.com/articleshow/130150492.cms,2026-04-16T07:19:48+00:00
Times of India,Times of India • Sports,https://timesofindia.indiatimes.com/sports,sports,67,BJK Cup: India show rare grit to shock top-ranked New Zealand,https://timesofindia.indiatimes.com/articleshow/130130561.cms,2026-04-16T07:19:48+00:00
Times of India,Times of India • Sports,https://timesofindia.indiatimes.com/sports,sports,68,Watch: Daniil Medvedev smashes racquet seven times in ‘double bagel’ loss,https://timesofindia.indiatimes.com/articleshow/130128332.cms,2026-04-16T07:19:48+00:00
Times of India,Times of India • Sports,https://timesofindia.indiatimes.com/sports,sports,69,"BJK Cup: Vaishnavi, Sahaja post milestone wins; India beat New Zealand",https://timesofindia.indiatimes.com/articleshow/130117852.cms,2026-04-16T07:19:48+00:00
Times of India,Times of India • Sports,https://timesofindia.indiatimes.com/sports,sports,70,BJK Cup: India fall to Thailand despite Raina-Bhosale doubles fightback,https://timesofindia.indiatimes.com/articleshow/130108360.cms,2026-04-16T07:19:48+00:00
Times of India,Times of India • Sports,https://timesofindia.indiatimes.com/sports,sports,71,BJK Cup: India trail Thailand 0-1 as unseasonal rain stalls play,https://timesofindia.indiatimes.com/articleshow/130102421.cms,2026-04-16T07:19:48+00:00
Times of India,Times of India • Sports,https://timesofindia.indiatimes.com/sports,sports,72,BJK Cup: India put on backfoot by Thailand before rain halts play,https://timesofindia.indiatimes.com/articleshow/130093518.cms,2026-04-16T07:19:48+00:00
Times of India,Times of India • Sports,https://timesofindia.indiatimes.com/sports,sports,73,"‘End of an Era’: Viktor Axelsen retires at 32, Lakshya Sen pays emotional tribute",https://timesofindia.indiatimes.com/articleshow/130282730.cms,2026-04-16T07:19:48+00:00
Times of India,Times of India • Sports,https://timesofindia.indiatimes.com/sports,sports,74,Ayush Shetty aims for good showing at Worlds,https://timesofindia.indiatimes.com/articleshow/130251153.cms,2026-04-16T07:19:48+00:00
Times of India,Times of India • Sports,https://timesofindia.indiatimes.com/sports,sports,75,"Ayush Shetty loses to Shi Yu Qi, claims Badminton Asia Championships silver",https://timesofindia.indiatimes.com/articleshow/130229361.cms,2026-04-16T07:19:48+00:00
Times of India,Times of India • Sports,https://timesofindia.indiatimes.com/sports,sports,76,Ayush Shetty's dream run ends; loses to Shi Yu Qi in Badminton Asia Championships final,https://timesofindia.indiatimes.com/articleshow/130206465.cms,2026-04-16T07:19:48+00:00
Times of India,Times of India • Sports,https://timesofindia.indiatimes.com/sports,sports,77,‘Big wins will be a confidence booster for Ayush Shetty’,https://timesofindia.indiatimes.com/articleshow/130202578.cms,2026-04-16T07:19:48+00:00
Times of India,Times of India • Sports,https://timesofindia.indiatimes.com/sports,sports,78,Ayush Shetty vs Shi Yu Qi live: When and Where to Watch Badminton Asia Championships final?,https://timesofindia.indiatimes.com/articleshow/130202283.cms,2026-04-16T07:19:48+00:00
Times of India,Times of India • Sports,https://timesofindia.indiatimes.com/sports,sports,79,Final Fling: Ayush Shetty to play China's Shi Yu Qi in Badminton Asia Championships final,https://timesofindia.indiatimes.com/articleshow/130202231.cms,2026-04-16T07:19:48+00:00
Times of India,Times of India • Sports,https://timesofindia.indiatimes.com/sports,sports,80,"Ayush Shetty scripts history, stuns world No. 1 to reach Asian Championships badminton final",https://timesofindia.indiatimes.com/articleshow/130187099.cms,2026-04-16T07:19:48+00:00
Times of India,Times of India • Sports,https://timesofindia.indiatimes.com/sports,sports,81,"20-year-old Ayush Shetty enters semis, secures historic medal",https://timesofindia.indiatimes.com/articleshow/130185852.cms,2026-04-16T07:19:48+00:00
Times of India,Times of India • Sports,https://timesofindia.indiatimes.com/sports,sports,82,Asia Badminton Championships: Ayush Shetty downs World No. 4 Jonatan Christie; India’s first medal secured,https://timesofindia.indiatimes.com/articleshow/130176056.cms,2026-04-16T07:19:48+00:00
Times of India,Times of India • Sports,https://timesofindia.indiatimes.com/sports,sports,83,"Badminton Asia Championships: Ayush Shetty in quarters; Sindhu, Prannoy out",https://timesofindia.indiatimes.com/articleshow/130160925.cms,2026-04-16T07:19:48+00:00
Times of India,Times of India • Sports,https://timesofindia.indiatimes.com/sports,sports,84,"Badminton Asia Championships: Ayush stuns China’s Li; Sindhu, Prannoy advance",https://timesofindia.indiatimes.com/articleshow/130130392.cms,2026-04-16T07:19:48+00:00
Times of India,Times of India • Sports,https://timesofindia.indiatimes.com/sports,sports,85,"Badminton Asia Championships: Ayush Shetty stuns world No. 7 Feng; Sindhu, HS Prannoy also win",https://timesofindia.indiatimes.com/articleshow/130120572.cms,2026-04-16T07:19:48+00:00
Times of India,Times of India • Sports,https://timesofindia.indiatimes.com/sports,sports,86,"Boosted by her Orleans show, Baruah targets better on-court fitness ahead of Thomas & Uber Cup",https://timesofindia.indiatimes.com/articleshow/130034829.cms,2026-04-16T07:19:48+00:00
Times of India,Times of India • Sports,https://timesofindia.indiatimes.com/sports,sports,87,'You were a complete pain on court': PV Sindhu pays tribute to Carolina Marin,https://timesofindia.indiatimes.com/articleshow/129847164.cms,2026-04-16T07:19:48+00:00
Times of India,Times of India • Sports,https://timesofindia.indiatimes.com/sports,sports,88,"Carolina Marin, one of badminton’s greatest and Rio Olympics gold medallist, retires at 32",https://timesofindia.indiatimes.com/articleshow/129825701.cms,2026-04-16T07:19:48+00:00
Times of India,Times of India • Sports,https://timesofindia.indiatimes.com/sports,sports,89,NHL agents suggest massive $20M AAV projection for Macklin Celebrini's next contract,https://timesofindia.indiatimes.com/articleshow/130289172.cms,2026-04-16T07:19:48+00:00
Times of India,Times of India • Sports,https://timesofindia.indiatimes.com/sports,sports,90,Tampa Bay Lightning and Montreal Canadiens playoff opener pushed due to arena conflict and broadcast scheduling,https://timesofindia.indiatimes.com/articleshow/130285201.cms,2026-04-16T07:19:48+00:00
Times of India,Times of India • Sports,https://timesofindia.indiatimes.com/sports,sports,91,Latest NHL update Edmonton Oilers' Connor McDavid $20 million deal projection drives Toronto Maple Leafs roster strategy,https://timesofindia.indiatimes.com/articleshow/130284457.cms,2026-04-16T07:19:48+00:00
Times of India,Times of India • Sports,https://timesofindia.indiatimes.com/sports,sports,92,Edmonton Oilers star Connor McDavid’s $20M projection fuels future contract possibilities with Toronto Maple Leafs,https://timesofindia.indiatimes.com/articleshow/130267609.cms,2026-04-16T07:19:48+00:00
Times of India,Times of India • Sports,https://timesofindia.indiatimes.com/sports,sports,93,Alex Ovechkin nears the final chapter as NHL's greatest goal scorer faces an uncertain future,https://timesofindia.indiatimes.com/articleshow/130264892.cms,2026-04-16T07:19:48+00:00
Times of India,Times of India • Sports,https://timesofindia.indiatimes.com/sports,sports,94,Edmonton Oilers' Leon Draisaitl latest injury update boosts NHL playoff hopes despite uncertain return timeline,https://timesofindia.indiatimes.com/articleshow/130260626.cms,2026-04-16T07:19:48+00:00
Times of India,Times of India • Sports,https://timesofindia.indiatimes.com/sports,sports,95,Toronto Maple Leafs face Auston Matthews trade rumors amid leadership changes and uncertain NHL future,https://timesofindia.indiatimes.com/articleshow/130260086.cms,2026-04-16T07:19:48+00:00
Times of India,Times of India • Sports,https://timesofindia.indiatimes.com/sports,sports,96,NHL rumors highlight potential landing spots for Ottawa Senators captain Brady Tkachuk ahead of the offseason,https://timesofindia.indiatimes.com/articleshow/130243846.cms,2026-04-16T07:19:48+00:00
Times of India,Times of India • Sports,https://timesofindia.indiatimes.com/sports,sports,97,Dallas Stars sign Christian Fitzgerald to an entry-level contract after an impressive NCAA career,https://timesofindia.indiatimes.com/articleshow/130242812.cms,2026-04-16T07:19:48+00:00
Times of India,Times of India • Sports,https://timesofindia.indiatimes.com/sports,sports,98,Washington Capitals forward Tom Wilson latest injury update after blocking shot against Pittsburgh Penguins NHL game,https://timesofindia.indiatimes.com/articleshow/130237222.cms,2026-04-16T07:19:48+00:00
Times of India,Times of India • Sports,https://timesofindia.indiatimes.com/sports,sports,99,Alexis Lafreniere NHL trade rumor intensifies as New York Rangers explore offseason moves with Detroit Red Wings and Los Angeles Kings,https://timesofindia.indiatimes.com/articleshow/130237116.cms,2026-04-16T07:19:48+00:00
Times of India,Times of India • Sports,https://timesofindia.indiatimes.com/sports,sports,100,Jared Bednar injury update: What happened to Colorado Avalanche coach,https://timesofindia.indiatimes.com/articleshow/130222877.cms,2026-04-16T07:19:48+00:00
Times of India,Times of India • Sports,https://timesofindia.indiatimes.com/sports,sports,101,Toronto Maple Leafs could trade Anthony Stolarz or Joseph Woll amid growing NHL offseason rumor,https://timesofindia.indiatimes.com/articleshow/130193517.cms,2026-04-16T07:19:48+00:00
Times of India,Times of India • Sports,https://timesofindia.indiatimes.com/sports,sports,102,NHL Boston Bruins lineup decisions highlight James Hagens and Morgan Geekie before Tampa Bay match,https://timesofindia.indiatimes.com/articleshow/130193218.cms,2026-04-16T07:19:48+00:00
Times of India,Times of India • Sports,https://timesofindia.indiatimes.com/sports,sports,103,NHL offseason trade rumors grow around Toronto Maple Leafs' Auston Matthews and Ottawa Senators' Brady Tkachuk,https://timesofindia.indiatimes.com/articleshow/130193162.cms,2026-04-16T07:19:48+00:00
Times of India,Times of India • Sports,https://timesofindia.indiatimes.com/sports,sports,104,Latest update on Edmonton Oilers as Connor McDavid dominates amid Leon Draisaitl injury concerns before NHL Stanley Cup Playoffs,https://timesofindia.indiatimes.com/articleshow/130192809.cms,2026-04-16T07:19:48+00:00
Times of India,Times of India • Sports,https://timesofindia.indiatimes.com/sports,sports,105,"Is Fortnite down (April 16, 2026)? v40.20 update server downtime details",https://timesofindia.indiatimes.com/articleshow/130298498.cms,2026-04-16T07:19:48+00:00
Times of India,Times of India • Sports,https://timesofindia.indiatimes.com/sports,sports,106,Fortnite v40.20 update release time for all regions,https://timesofindia.indiatimes.com/articleshow/130298078.cms,2026-04-16T07:19:48+00:00
Times of India,Times of India • Sports,https://timesofindia.indiatimes.com/sports,sports,107,How to download Minecraft Bedrock 26.20.27 beta and preview,https://timesofindia.indiatimes.com/articleshow/130284982.cms,2026-04-16T07:19:48+00:00
Times of India,Times of India • Sports,https://timesofindia.indiatimes.com/sports,sports,108,EA FC 26 Serie A TOTS players leaked: Ratings and more,https://timesofindia.indiatimes.com/articleshow/130284349.cms,2026-04-16T07:19:48+00:00
Times of India,Times of India • Sports,https://timesofindia.indiatimes.com/sports,sports,109,All active Fortnite Garden vs Brainrots codes (April 2026),https://timesofindia.indiatimes.com/articleshow/130260952.cms,2026-04-16T07:19:48+00:00
Times of India,Times of India • Sports,https://timesofindia.indiatimes.com/sports,sports,110,Everything new in Fortnite v40.20 update,https://timesofindia.indiatimes.com/articleshow/130257417.cms,2026-04-16T07:19:48+00:00
Times of India,Times of India • Sports,https://timesofindia.indiatimes.com/sports,sports,111,"Esports Nations Cup announces 16-game lineup; 100,000 players from 100 nations to compete",https://timesofindia.indiatimes.com/articleshow/130251867.cms,2026-04-16T07:19:48+00:00
Times of India,Times of India • Sports,https://timesofindia.indiatimes.com/sports,sports,112,How to build automatic Kelp Farm in Minecraft Bedrock,https://timesofindia.indiatimes.com/articleshow/130230217.cms,2026-04-16T07:19:48+00:00
Times of India,Times of India • Sports,https://timesofindia.indiatimes.com/sports,sports,113,"Fortnite Laufey skin release date, price, and more details",https://timesofindia.indiatimes.com/articleshow/130225788.cms,2026-04-16T07:19:48+00:00
Times of India,Times of India • Sports,https://timesofindia.indiatimes.com/sports,sports,114,"Top 20 Clash Royale decks in 2026 ranked: Full card lists, meta insights, and strategy guide (April)",https://timesofindia.indiatimes.com/articleshow/130194324.cms,2026-04-16T07:19:48+00:00
Times of India,Times of India • Sports,https://timesofindia.indiatimes.com/sports,sports,115,"Fortnite Reload Elite Stronghold update release date, new map, weapons, and more",https://timesofindia.indiatimes.com/articleshow/130204825.cms,2026-04-16T07:19:48+00:00
Times of India,Times of India • Sports,https://timesofindia.indiatimes.com/sports,sports,116,EA FC 26 Premier League Team of the Season (TOTS) predictions,https://timesofindia.indiatimes.com/articleshow/130204413.cms,2026-04-16T07:19:48+00:00
Times of India,Times of India • Sports,https://timesofindia.indiatimes.com/sports,sports,117,"Fortnite High Flyin' Power Hour (April 11, 2026): Start timings for all regions",https://timesofindia.indiatimes.com/articleshow/130187257.cms,2026-04-16T07:19:48+00:00
Times of India,Times of India • Sports,https://timesofindia.indiatimes.com/sports,sports,118,How to get Toy Story skins in Fortnite: Buzz Lightyear and Zurg,https://timesofindia.indiatimes.com/articleshow/130186876.cms,2026-04-16T07:19:48+00:00
Times of India,Times of India • Sports,https://timesofindia.indiatimes.com/sports,sports,119,"Minecraft Chaos Cubed update: Release date, features and more",https://timesofindia.indiatimes.com/articleshow/130175456.cms,2026-04-16T07:19:48+00:00
Times of India,Times of India • Sports,https://timesofindia.indiatimes.com/sports,sports,120,"Fortnite OG Mini Event (April 11, 2026): Timings for all regions",https://timesofindia.indiatimes.com/articleshow/130174347.cms,2026-04-16T07:19:48+00:00
Times of India,Times of India • Sports,https://timesofindia.indiatimes.com/sports,sports,121,"WWE WrestleMania 42 Night 1 and 2 matches, main event, full predictions and more",https://timesofindia.indiatimes.com/articleshow/130286131.cms,2026-04-16T07:19:48+00:00
Times of India,Times of India • Sports,https://timesofindia.indiatimes.com/sports,sports,122,"WWE WrestleMania 42: US, UK, India, Brazil, Saudi Arabia, Japan start timings, how to watch live, date, venue, full match card, and more",https://timesofindia.indiatimes.com/articleshow/130285462.cms,2026-04-16T07:19:48+00:00
Times of India,Times of India • Sports,https://timesofindia.indiatimes.com/sports,sports,123,"WWE RAW News Roundup: Popular interviewer takes nasty bump, Seth Rollins & Gunther brawl ahead of WrestleMania 42 and more",https://timesofindia.indiatimes.com/articleshow/130249677.cms,2026-04-16T07:19:48+00:00
Times of India,Times of India • Sports,https://timesofindia.indiatimes.com/sports,sports,124,"WWE RAW Results & Highlights 13-april-2026: Roman Reigns & CM Punk share final words before WrestleMania 42, major matches and more",https://timesofindia.indiatimes.com/articleshow/130249518.cms,2026-04-16T07:19:48+00:00
Times of India,Times of India • Sports,https://timesofindia.indiatimes.com/sports,sports,125,"WWE RAW updates: All superstars confirmed for the show, Roman Reigns' special message, and more",https://timesofindia.indiatimes.com/articleshow/130226707.cms,2026-04-16T07:19:48+00:00
Times of India,Times of India • Sports,https://timesofindia.indiatimes.com/sports,sports,126,"WWE RAW Tonight 13-april-2026: Full match card, confirmed segments, start timings & how to watch",https://timesofindia.indiatimes.com/articleshow/130226270.cms,2026-04-16T07:19:48+00:00
Times of India,Times of India • Sports,https://timesofindia.indiatimes.com/sports,sports,127,"WWE SmackDown News Roundup: Pat McAfee & Randy Orton steal Cody Rhodes' title, two major in-ring debuts, and more",https://timesofindia.indiatimes.com/articleshow/130183295.cms,2026-04-16T07:19:48+00:00
Times of India,Times of India • Sports,https://timesofindia.indiatimes.com/sports,sports,128,"WWE SmackDown Results & Highlights 10-april-2026: Pat McAfee's surprise announcement, blockbuster main event match and more",https://timesofindia.indiatimes.com/articleshow/130182896.cms,2026-04-16T07:19:48+00:00
Times of India,Times of India • Sports,https://timesofindia.indiatimes.com/sports,sports,129,"WWE SmackDown 10-april-2026: All superstars confirmed for the show, major debut, and more",https://timesofindia.indiatimes.com/articleshow/130160976.cms,2026-04-16T07:19:48+00:00
Times of India,Times of India • Sports,https://timesofindia.indiatimes.com/sports,sports,130,"WWE WrestleMania 42 2026 Predictions: 5 huge surprise returns featuring The Rock, Undertaker & more",https://timesofindia.indiatimes.com/articleshow/130161379.cms,2026-04-16T07:19:48+00:00
Times of India,Times of India • Sports,https://timesofindia.indiatimes.com/sports,sports,131,"WWE SmackDown Tonight 10-april-2026: Full match card, confirmed segments, start timings & how to watch",https://timesofindia.indiatimes.com/articleshow/130160817.cms,2026-04-16T07:19:48+00:00
Times of India,Times of India • Sports,https://timesofindia.indiatimes.com/sports,sports,132,WrestleMania 42 Predictions: Can John Cena confront a former WWE World champion at the event?,https://timesofindia.indiatimes.com/articleshow/130128475.cms,2026-04-16T07:19:48+00:00
Times of India,Times of India • Sports,https://timesofindia.indiatimes.com/sports,sports,133,"WWE WrestleMania 42; Full match cards for Night 1 & 2, Main Event, and more",https://timesofindia.indiatimes.com/articleshow/130089998.cms,2026-04-16T07:19:48+00:00
Times of India,Times of India • Sports,https://timesofindia.indiatimes.com/sports,sports,134,What did Hulk Hogan say in his final interview? Netflix’s upcoming docuseries trailer reveals heartbreaking final words from WWE legend,https://timesofindia.indiatimes.com/articleshow/130074987.cms,2026-04-16T07:19:48+00:00
Times of India,Times of India • Sports,https://timesofindia.indiatimes.com/sports,sports,135,"WWE RAW News Roundup: Hall of Famer returns, six-man match added for WrestleMania 42, and more",https://timesofindia.indiatimes.com/articleshow/130074648.cms,2026-04-16T07:19:48+00:00
Times of India,Times of India • Sports,https://timesofindia.indiatimes.com/sports,sports,136,"WWE RAW Results & Highlights 6-april-2026: Brock Lesnar & Oba Femi brawl, CM Punk appears and more",https://timesofindia.indiatimes.com/articleshow/130074513.cms,2026-04-16T07:19:48+00:00
Times of India,Times of India • Sports,https://timesofindia.indiatimes.com/sports,sports,137,"Phil Garner net worth, inside Astros manager career and earnings after death at 76",https://timesofindia.indiatimes.com/articleshow/130220413.cms,2026-04-16T07:19:48+00:00
Times of India,Times of India • Sports,https://timesofindia.indiatimes.com/sports,sports,138,Los Angeles Dodgers legend Davey Lopes passes away at 80 after Parkinson’s disease fight,https://timesofindia.indiatimes.com/articleshow/130123181.cms,2026-04-16T07:19:48+00:00
Times of India,Times of India • Sports,https://timesofindia.indiatimes.com/sports,sports,139,Ozzie Guillen left in tears during live MLB broadcast as Chicago White Sox deliver emotional surprise,https://timesofindia.indiatimes.com/articleshow/130026888.cms,2026-04-16T07:19:48+00:00
Times of India,Times of India • Sports,https://timesofindia.indiatimes.com/sports,sports,140,Konnor Griffin’s $140 million MLB debut turns emotional as wife and mom react wildly to RBI double,https://timesofindia.indiatimes.com/articleshow/130026374.cms,2026-04-16T07:19:48+00:00
Times of India,Times of India • Sports,https://timesofindia.indiatimes.com/sports,sports,141,"Jonathan Lucroy calls out Travis Kelce and Jason Kelce after bold baseball workout comments, highlights true MLB endurance struggle",https://timesofindia.indiatimes.com/articleshow/129989702.cms,2026-04-16T07:19:48+00:00
Times of India,Times of India • Sports,https://timesofindia.indiatimes.com/sports,sports,142,Why did fans fight at Dodger Stadium on opening day? Viral video shows Los Angeles Dodgers vs Arizona Diamondbacks game spiraling into chaos,https://timesofindia.indiatimes.com/articleshow/129869628.cms,2026-04-16T07:19:48+00:00
Times of India,Times of India • Sports,https://timesofindia.indiatimes.com/sports,sports,143,Alex Vesia’s wife Kayla Vesia reveals pain of losing daughter Sterling during emotional Dodgers Opening Day moment,https://timesofindia.indiatimes.com/articleshow/129852255.cms,2026-04-16T07:19:48+00:00
Times of India,Times of India • Sports,https://timesofindia.indiatimes.com/sports,sports,144,"Jason Heyward net worth in 2026: Inside his MLB career, earnings, Cubs title impact and retirement decision",https://timesofindia.indiatimes.com/articleshow/129851703.cms,2026-04-16T07:19:48+00:00
Times of India,Times of India • Sports,https://timesofindia.indiatimes.com/sports,sports,145,Paul Skenes nightmare in New York as Livvy Dunne’s boyfriend pulled early after Pittsburgh Pirates Opening Day collapse,https://timesofindia.indiatimes.com/articleshow/129834078.cms,2026-04-16T07:19:48+00:00
Times of India,Times of India • Sports,https://timesofindia.indiatimes.com/sports,sports,146,MLB Opening Day 2026 turns chaotic as Max Fried dominates but fans slam Netflix Yankees vs Giants broadcast,https://timesofindia.indiatimes.com/articleshow/129833814.cms,2026-04-16T07:19:48+00:00
Times of India,Times of India • Sports,https://timesofindia.indiatimes.com/sports,sports,147,Zack Short traded for cash to Washington Nationals adds fuel as New York Yankees fans react to Hal Steinbrenner payroll stance,https://timesofindia.indiatimes.com/articleshow/129813800.cms,2026-04-16T07:19:48+00:00
Times of India,Times of India • Sports,https://timesofindia.indiatimes.com/sports,sports,148,Tom Brady faces backlash after MLB great Tim McCarver death error in newsletter forces second public apology,https://timesofindia.indiatimes.com/articleshow/129811018.cms,2026-04-16T07:19:48+00:00
Times of India,Times of India • Sports,https://timesofindia.indiatimes.com/sports,sports,149,Who are Freddie Freeman’s three sons? Meet the three boys behind MLB's biggest superstars,https://timesofindia.indiatimes.com/articleshow/129786645.cms,2026-04-16T07:19:48+00:00
Times of India,Times of India • Sports,https://timesofindia.indiatimes.com/sports,sports,150,Roki Sasaki contract with Dodgers: How much he earns and what’s included in his MLB deal,https://timesofindia.indiatimes.com/articleshow/129786615.cms,2026-04-16T07:19:48+00:00
Times of India,Times of India • Sports,https://timesofindia.indiatimes.com/sports,sports,151,Detroit Tigers fire employee after toxic culture claim as fresh controversy hits before 2026 season opener,https://timesofindia.indiatimes.com/articleshow/129786513.cms,2026-04-16T07:19:48+00:00
Times of India,Times of India • Sports,https://timesofindia.indiatimes.com/sports,sports,152,Ken Griffey Jr grabs attention as Masters 2026 builds hype around baseball legend’s bold photography career shift,https://timesofindia.indiatimes.com/articleshow/129786333.cms,2026-04-16T07:19:48+00:00
Times of India,Times of India • Sports,https://timesofindia.indiatimes.com/sports,sports,153,"Pascal Wehrlein impresses on the slopes in the Swiss Alps with skiing and snowboarding, watch",https://timesofindia.indiatimes.com/articleshow/130285061.cms,2026-04-16T07:19:48+00:00
